1091183185,column,column,column,column,1925912,_______________beaba,beaba,___beaba_green_920383,column,485,1,httpscomfyuatermometrdljavannybeabagreen920383html,column,05112025_2049,column,__42,Фастів,0
1091183185,,,,,1925912,"Детские товары >> Уход, купание и гигиена >> Принадлежности для купания >> Принадлежности для купания Beaba",beaba,Термометр для ванни Beaba Green (920383),,485,1,https://comfy.ua/termometr-dlja-vanny-beaba-green-920383.html,,05.11.2025 20:49,,"вул. Соборна, 42",Фастів,0
1091183186,6776514,ELECTROLUX,Пылесос ELECTROLUX EERC75DB,4999,1921937,Техника для дома >> Мелкая техника >> Ручные пылесосы >> Ручные пылесосы Electrolux,electrolux,Пилосос ручний для дому Electrolux EERC75DB,,4999,1,https://comfy.ua/pylesos-ruchnoj-dlja-doma-electrolux-eerc75db.html,,05.11.2025 17:56,,"вул. Соборна, 42",Фастів,0
1091183188,,,,,.1925831,Детские товары >> Игрушки,super-wings,Пластиковий конструктор Super Wings Small Blocks Buildable Vehicle Set Rover Ровер (EU385013),,1099,1,https://comfy.ua/plastikovyj-konstruktor-super-wings-small-blocks-buildable-vehicle-set-rover-rover-eu385013.html,1789,06.11.2025 0:35,,"вул. Соборна, 42",Фастів,0
1091183190,,,,,1925913,"Детские товары >> Уход, купание и гигиена >> Принадлежности для купания >> Принадлежности для купания Beaba",beaba,Термометр для ванни Beaba Pink (920384),,485,1,https://comfy.ua/termometr-dlja-vanny-beaba-pink-920384.html,,05.11.2025 20:54,,"вул. Соборна, 42",Фастів,0
1091183228,6784880,SIEMENS,Встраиваемый холодильник SIEMENS iQ500 KI86NAD306,59999,1879491,Техника для кухни >> Крупная техника >> Холодильники >> Холодильники Siemens,siemens,Холодильник вбудований Siemens KI86NAD306,,59999,1,https://comfy.ua/holodil-nik-vstraivaemyj-siemens-ki86nad306.html,67799,05.11.2025 18:33,,"вул. Соборна, 42",Фастів,0
1091198739,6812047,FISKARS,"Нож поварской FISKARS Norden 13,5 см (1026420)",4313,1915976,Посуда >> Нарезка и измельчение >> Ножи и наборы >> Ножи и наборы Fiskars,fiskars,Ніж кухаря Fiskars Norden (1026420),,5750,1,https://comfy.ua/nozh-povara-fiskars-norden-1026420.html,,05.11.2025 19:56,,"вул. Соборна, 42",Фастів,0
1091198740,6812050,FISKARS,Нож филейный FISKARS Norden 20.3 см (1026423),7290,1915979,Посуда >> Нарезка и измельчение >> Ножи и наборы >> Ножи и наборы Fiskars,fiskars,Ніж для м'яса Fiskars Norden (1026423),,7290,1,https://comfy.ua/nozh-dlja-mjasa-fiskars-norden-1026423.html,,05.11.2025 19:43,,"вул. Соборна, 42",Фастів,0
1091198741,6812049,FISKARS,Нож разделочный FISKARS Norden 20 см (1026422),7839,1915978,Посуда >> Нарезка и измельчение >> Ножи и наборы >> Ножи и наборы Fiskars,fiskars,Ніж для м'яса Fiskars Norden (1026422),,7839,1,https://comfy.ua/nozh-dlja-mjasa-fiskars-norden-1026422.html,,05.11.2025 20:01,,"вул. Соборна, 42",Фастів,0
1091198742,6812046,FISKARS,Нож поварской FISKARS Norden 21 см (1026419),6323,1915975,Посуда >> Нарезка и измельчение >> Ножи и наборы >> Ножи и наборы Fiskars,fiskars,Ніж кухаря Fiskars Norden (1026419),,8430,1,https://comfy.ua/nozh-povara-fiskars-norden-1026419.html,,05.11.2025 19:44,,"вул. Соборна, 42",Фастів,0
1091198743,6812048,FISKARS,Нож для хлеба FISKARS Norden 22 см (1026421),7958,1915977,Посуда >> Нарезка и измельчение >> Ножи и наборы >> Ножи и наборы Fiskars,fiskars,Ніж для хліба Fiskars Norden (1026421),,8430,1,https://comfy.ua/nozh-dlja-hleba-fiskars-norden-1026421.html,,05.11.2025 20:01,,"вул. Соборна, 42",Фастів,0
1091216079,,,,,.1870753,Посуда >> Для напитков,versailles,Набір склянок Versailles 480 мл 6 шт. (VS-5480),,349,1,https://comfy.ua/nabor-stakanov-versailles-480-ml-6-sht-vs-5480.html,,05.11.2025 19:30,,"вул. Соборна, 42",Фастів,0
1091216660,6789444,ARDESTO,Ложка ARDESTO Gemini AR2120SB,99,1909532,Посуда >> Кухонные аксессуары >> Кухонные принадлежности >> Кухонные принадлежности Ardesto,ardesto,Ложка кухарська Ardesto Gemini (AR2120SB),,99,1,https://comfy.ua/lozhka-povarskaja-ardesto-gemini-ar2120sb.html,249,05.11.2025 18:59,,"вул. Соборна, 42",Фастів,0
1091216951,6789529,ARDESTO,Шумовка ARDESTO Gemini (AR2122SB),185,1909534,Посуда >> Кухонные аксессуары >> Кухонные принадлежности >> Кухонные принадлежности Ardesto,ardesto,Шумовка Ardesto Gemini (AR2122SB),,185,1,https://comfy.ua/shumovka-ardesto-gemini-ar2122sb.html,249,05.11.2025 18:58,,"вул. Соборна, 42",Фастів,0
1091228917,6789457,ARDESTO,Молоток для мяса ARDESTO Black Mars 22.5 см (AR2019SA),439,1909531,Посуда >> Кухонные аксессуары >> Посуда для мяса и рыбы >> Посуда для мяса и рыбы Ardesto,ardesto,Молоток для м'яса Ardesto Black Mars 22.5 см (AR2019SA),,439,1,https://comfy.ua/molotok-dlja-mjasa-ardesto-black-mars-22-5-sm-ar2019sa.html,589,05.11.2025 18:55,,"вул. Соборна, 42",Фастів,0
1091252936,6792419,BORMIOLI ROCCO,Набор стаканов BORMIOLI ROCCO BARTENDER LOUNGE 6 x 275 мл (666223BAU121990),921,1879617,Посуда >> Для напитков >> Стаканы >> Стаканы Bormioli Rocco,bormioli-rocco,Набір склянок Bormioli Rocco Bartender Lounge 6x275 мл (666223BAU121990),,921,1,https://comfy.ua/nabor-stakanov-bormioli-rocco-bartender-lounge-6x275-ml-666223bau121990.html,,05.11.2025 20:27,,"вул. Соборна, 42",Фастів,0
1091252937,6792420,BORMIOLI ROCCO,Набор стаканов BORMIOLI ROCCO BARTENDER LOUNGE 6 x 390 мл (666224BAU121990),988,1879618,Посуда >> Для напитков >> Стаканы >> Стаканы Bormioli Rocco,bormioli-rocco,Набір склянок Bormioli Rocco Bartender Lounge 6x390 мл (666224BAU121990),,988,1,https://comfy.ua/nabor-stakanov-bormioli-rocco-bartender-lounge-6x390-ml-666224bau121990.html,,05.11.2025 20:20,,"вул. Соборна, 42",Фастів,0
1091294586,,,,,1870756,Посуда >> Для сервировки >> Тарелки и салатники >> Тарелки и салатники Versailles,versailles,Салатник Versailles 210 мм 1880 мл (VS-6188),,375,1,https://comfy.ua/salatnik-versailles-210-mm-1880-ml-vs-6188.html,,05.11.2025 20:15,,"вул. Соборна, 42",Фастів,0
1091295868,,,,,.1870757,Посуда >> Для сервировки,versailles,Салатник Versailles 196 мм 1900 мл (VS-6190),,311,1,https://comfy.ua/salatnik-versailles-196-mm-1900-ml-vs-6190.html,,05.11.2025 20:15,,"вул. Соборна, 42",Фастів,0
1091295999,6789446,ARDESTO,Лопатка ARDESTO Gemini (AR2124SB),185,1909536,Посуда >> Кухонные аксессуары >> Кухонные принадлежности >> Кухонные принадлежности Ardesto,ardesto,Лопатка кухонна Ardesto Gemini (AR2124SB),,185,1,https://comfy.ua/lopatka-kuhonnaja-ardesto-gemini-ar2124sb.html,249,05.11.2025 18:58,,"вул. Соборна, 42",Фастів,0
1091305037,6789464,ARDESTO,Терка Ardesto Gemini (AR2131SS),185,1909538,"Посуда >> Нарезка и измельчение >> Терки, шинковки >> Терки, шинковки Ardesto",ardesto,Терка Ardesto Gemini (AR2131SS),,185,1,https://comfy.ua/terka-ardesto-gemini-ar2131ss.html,,05.11.2025 19:29,,"вул. Соборна, 42",Фастів,0
1091305312,6456845,ARTEL,Плита газовая ARTEL APETITO 10-G Grey (2064568450019),12899,1430813,Техника для кухни >> Крупная техника >> Плиты >> Плиты ARTEL,artel,Плита газова ARTEL Apetito 10-G Grey,,12899,1,https://comfy.ua/plita-gazovaja-artel-apetito-10-g-grey.html,,05.11.2025 21:21,,"вул. Соборна, 42",Фастів,0
1091332013,6812051,FISKARS,Нож для овощей FISKARS Norden 9.6 см (1026424),3600,1915980,Посуда >> Нарезка и измельчение >> Ножи и наборы >> Ножи и наборы Fiskars,fiskars,Ніж для коренеплодів Fiskars Norden (1026424),,4800,1,https://comfy.ua/nozh-dlja-korneplodov-fiskars-norden-1026424.html,,05.11.2025 19:46,,"вул. Соборна, 42",Фастів,0
1091399768,6842010,ARTEL,Плита комбинированная ARTEL APETITO 50 01-E Brown,12615,1925293,Техника для кухни >> Крупная техника >> Плиты >> Плиты ARTEL,artel,Плита газова ARTEL Apetito 50 01-E Brown,,12615,1,https://comfy.ua/plita-gazovaja-artel-apetito-50-01-e-brown.html,,05.11.2025 21:01,,"вул. Соборна, 42",Фастів,0
1091399788,6812276,ARTEL,Плита газовая ARTEL APETITO 50 10-G White,11865,1925294,Техника для кухни >> Крупная техника >> Плиты >> Плиты ARTEL,artel,Плита газова ARTEL Apetito 50 10-G White,,12489,1,https://comfy.ua/plita-gazovaja-artel-apetito-50-10-g-white.html,,05.11.2025 20:50,,"вул. Соборна, 42",Фастів,0
1091399844,6912291,ARTEL,Плита газовая ARTEL APETITO 50 10-G Brown,11865,1925292,Техника для кухни >> Крупная техника >> Плиты >> Плиты ARTEL,artel,Плита газова ARTEL Apetito 50 10-G Brown,,12615,1,https://comfy.ua/plita-gazovaja-artel-apetito-50-10-g-brown.html,,05.11.2025 20:53,,"вул. Соборна, 42",Фастів,0
1091399884,6746320,PROMATE,Гарнитура Promate Panda Lilac (panda.lilac),1599,1924568,"Аудио, фото и видео >> Наушники >> Наушники Promate",promate,Навушники накладні бездротові Promate Panda.Lilac,,1599,1,https://comfy.ua/naushniki-nakladnye-besprovodnye-promate-panda-lilac.html,,05.11.2025 18:18,,"вул. Соборна, 42",Фастів,0
1091399893,6746318,PROMATE,Гарнитура Promate Panda Aqua (panda.aqua),1299,1924566,"Аудио, фото и видео >> Наушники >> Наушники Promate",promate,Навушники накладні бездротові Promate Panda.Aqua,,1299,1,https://comfy.ua/naushniki-nakladnye-besprovodnye-promate-panda-aqua.html,1599,05.11.2025 18:23,,"вул. Соборна, 42",Фастів,0
1091472742,6789447,ARDESTO,Лопатка ARDESTO Midori 31.5 см (AR3020GB),125,1909594,Посуда >> Кухонные аксессуары >> Кухонные принадлежности >> Кухонные принадлежности Ardesto,ardesto,Лопатка кухонна Ardesto Midori (AR3020GB),,149,1,https://comfy.ua/lopatka-kuhonnaja-ardesto-midori-ar3020gb.html,,05.11.2025 18:57,,"вул. Соборна, 42",Фастів,0
1091472796,6789530,ARDESTO,Шумовка ARDESTO Midori (AR3019GB),125,1909593,Посуда >> Кухонные аксессуары >> Кухонные принадлежности >> Кухонные принадлежности Ardesto,ardesto,Шумовка Ardesto Midori (AR3019GB),,149,1,https://comfy.ua/shumovka-ardesto-midori-ar3019gb.html,,05.11.2025 19:41,,"вул. Соборна, 42",Фастів,0
1091475232,6789452,ARDESTO,Щипцы ARDESTO Gemini 21 см (AR2134SS),99,1909541,Посуда >> Кухонные аксессуары >> Посуда для мяса и рыбы >> Посуда для мяса и рыбы Ardesto,ardesto,Щипці кухонні Ardesto Gemini 21 см (AR2134SS),,99,1,https://comfy.ua/schipcy-kuhonnye-ardesto-gemini-21-sm-ar2134ss.html,125,05.11.2025 18:54,,"вул. Соборна, 42",Фастів,0
1091475246,6789435,ARDESTO,"Ковш ARDESTO Gemini Bari 0,8 л (AR1908SSG)",439,1909117,Посуда >> Для приготовления >> Ковши и сотейники >> Ковши и сотейники Ardesto,ardesto,Ківш Ardesto AR1908SSG Gemini Bari 0.8 л,,395,1,https://comfy.ua/kovsh-ardesto-ar1908ssg-gemini-bari-0-8-l.html,579,05.11.2025 19:12,,"вул. Соборна, 42",Фастів,0
1091475248,6789436,ARDESTO,Ковш ARDESTO Gemini Bari 1.2 л (AR1912SSG),429,1909118,Посуда >> Для приготовления,ardesto,Ківш Ardesto AR1912SSG Gemini Bari 1.2 л,,429,1,https://comfy.ua/kovsh-ardesto-ar1912ssg-gemini-bari-1-2-l.html,629,05.11.2025 18:56,,"вул. Соборна, 42",Фастів,2
1091493841,,,,,1847829,"Ноутбуки, планшеты и компьютерная техника >> Аксессуары для ноутбуков, планшетов и ПК >> Сумки для ноутбуков >> Сумки для ноутбуков HP",hp,Сумка для ноутбуку HP Prelude 15.6 Top Load (2Z8P4AA),,999,1,https://comfy.ua/sumka-dlja-noutbuka-hp-prelude-15-6-top-load-2z8p4aa.html,,05.11.2025 17:44,,"вул. Соборна, 42",Фастів,0
1091494278,6789469,ARDESTO,Форма для выпечки Ardesto Tasty Baking Blue (AR2320T),136,1909587,Посуда >> Для запекания и выпечки >> Формы и деко >> Формы и деко Ardesto,ardesto,Форма для приготування Ardesto Tasty Baking Blue (AR2320T),,136,1,https://comfy.ua/forma-dlja-prigotovlenija-ardesto-tasty-baking-blue-ar2320t.html,275,05.11.2025 18:56,,"вул. Соборна, 42",Фастів,0
1091494279,6789471,ARDESTO,Форма для выпечки кекса Ardesto Tasty Baking Blue (AR2319T),255,1909586,Посуда >> Для запекания и выпечки >> Формы и деко >> Формы и деко Ardesto,ardesto,Форма для приготування Ardesto Tasty Baking Blue (AR2319T),,258,1,https://comfy.ua/forma-dlja-prigotovlenija-ardesto-tasty-baking-blue-ar2319t.html,,05.11.2025 18:57,,"вул. Соборна, 42",Фастів,0
1091494280,6789467,ARDESTO,Форма для выпечки Ardesto Tasty Baking Blue (AR2321T),179,1909588,Посуда >> Для запекания и выпечки >> Формы и деко >> Формы и деко Ardesto,ardesto,Форма для приготування Ardesto Tasty Baking 26x25x6 см Blue (AR2321T),,179,1,https://comfy.ua/forma-dlja-prigotovlenija-ardesto-tasty-baking-26x25x6-sm-blue-ar2321t.html,339,05.11.2025 18:53,,"вул. Соборна, 42",Фастів,0
1091660573,6789463,ARDESTO,Терка ARDESTO Gemini (AR2132SS),202,1909539,"Посуда >> Нарезка и измельчение >> Терки, шинковки >> Терки, шинковки Ardesto",ardesto,Терка Ardesto Gemini (AR2132SS),,225,1,https://comfy.ua/terka-ardesto-gemini-ar2132ss.html,,05.11.2025 18:52,,"вул. Соборна, 42",Фастів,0
1091663037,7018453,OGX,Кондиционер OGX Coconut Milk Hair 385 мл (22796970060),437,1834531,"Красота и здоровье >> Косметика для волос >> Бальзамы, маски и сыворотки >> Бальзамы, маски и сыворотки OGX",ogx,Бальзам для волосся OGX Coconut Milk Поживний з кокосовим молоком 385 мл (0022796970060),,449,1,https://comfy.ua/bal-zam-dlja-volos-ogx-coconut-milk-pitatel-naja-s-kokosovym-molokom-385-ml-0022796970060.html,,05.11.2025 18:37,,"вул. Соборна, 42",Фастів,0
1091663742,6789477,ARDESTO,Форма для выпечки Мини Ardesto Gemini (AR2501G),125,1883231,Посуда >> Для запекания и выпечки,ardesto,Форма для випічки Ardesto Gemini 12x5 см Gray (AR2501G),,116,1,https://comfy.ua/catalog/product/view/id/3344133,175,05.11.2025 18:54,,"вул. Соборна, 42",Фастів,0
1091663768,,,,,1888854,Красота и здоровье >> Косметика для тела,dove,Рідке мило для рук DOVE Крем Захист та догляд 250мл,,133,1,https://comfy.ua/zhidkoe-mylo-dlja-ruk-dove-krem-zaschita-i-uhod-250ml.html,155,05.11.2025 18:39,,"вул. Соборна, 42",Фастів,0
1091663788,,,,,1855399,Красота и здоровье >> Косметика для тела,grand-sharm,Рідке мило для рук Grand Шарм Maxi Strawberry 5 л (4820195505045),,239,1,https://comfy.ua/zhidkoe-mylo-dlja-ruk-grand-sharm-maxi-strawberry-5-l-4820195505045.html,,05.11.2025 18:44,,"вул. Соборна, 42",Фастів,0
1091663820,6792428,BORMIOLI ROCCO,Салатник BORMIOLI ROCCO MR CHEF 9 см 50 мл (500000F28321990),40,1881362,Посуда >> Для сервировки >> Тарелки и салатники >> Тарелки и салатники Bormioli Rocco,bormioli-rocco,Салатник Bormioli Rocco Mr. Chef 9 см 50 мл (500000F28321990),,40,1,https://comfy.ua/salatnik-bormioli-rocco-mr-chef-9-sm-50-ml-500000f28321990.html,88,05.11.2025 19:53,,"вул. Соборна, 42",Фастів,0
1091664605,6792426,BORMIOLI ROCCO,Салатник BORMIOLI ROCCO MR CHEF 26 см 2000 мл (500050DN8021990),258,1881360,Посуда >> Для сервировки >> Тарелки и салатники >> Тарелки и салатники Bormioli Rocco,bormioli-rocco,Салатник Bormioli Rocco Mr. Chef 26 см 2000 мл (500050DN8021990),,518,1,https://comfy.ua/salatnik-bormioli-rocco-mr-chef-26-sm-2000-ml-500050dn8021990.html,,05.11.2025 20:14,,"вул. Соборна, 42",Фастів,0
1091664614,6792427,BORMIOLI ROCCO,Салатник BORMIOLI ROCCO MR CHEF 30 см 3000 мл (500060DN8021990),527,1881361,Посуда >> Для сервировки >> Тарелки и салатники >> Тарелки и салатники Bormioli Rocco,bormioli-rocco,Салатник Bormioli Rocco Mr. Chef 30 см 3000 мл (500060DN8021990),,595,1,https://comfy.ua/salatnik-bormioli-rocco-mr-chef-30-sm-3000-ml-500060dn8021990.html,,05.11.2025 20:24,,"вул. Соборна, 42",Фастів,0
1091668530,6789485,ARDESTO,Форма для запекания ARDESTO BLACK MARS 1.5+0.3 л (AR2415BG),355,1885729,Посуда >> Для запекания и выпечки,ardesto,Форма для приготування Ardesto Black Mars 1.5 л (AR2415BG),,355,1,https://comfy.ua/catalog/product/view/id/3344363,,05.11.2025 18:55,,"вул. Соборна, 42",Фастів,0
1091675342,6789445,ARDESTO,Ложка ARDESTO Midori (AR3017GB),125,1909591,Посуда >> Кухонные аксессуары >> Кухонные принадлежности >> Кухонные принадлежности Ardesto,ardesto,Ложка кухарська Ardesto Midori (AR3017GB),,149,1,https://comfy.ua/lozhka-povarskaja-ardesto-midori-ar3017gb.html,,05.11.2025 19:02,,"вул. Соборна, 42",Фастів,0
1091686381,6789443,ARDESTO,Точилка для ножей ARDESTO Gemini AR2133SS,265,1909540,Посуда >> Нарезка и измельчение >> Точила для ножей >> Точила для ножей Ardesto,ardesto,Точилка кухонних ножів Ardesto Gemini (AR2133SS),,265,1,https://comfy.ua/tochilka-kuhonnyh-nozhej-ardesto-gemini-ar2133ss.html,439,05.11.2025 18:58,,"вул. Соборна, 42",Фастів,0
1091691176,,,,,1853743,Техника для кухни >> Крупная техника >> Варочные панели >> Варочные панели Weilor,weilor,Варильна поверхня Domino Weilor GG 306 WH,,3999,1,https://comfy.ua/varochnaja-panel-domino-weilor-gg-306-wh.html,5099,05.11.2025 19:16,,"вул. Соборна, 42",Фастів,0
1091691238,7032074,HUILE TOYS,"""Игрушка Huile Toys """"Тележка с мороженным"""" (6101)""",826,1929577,Детские товары >> Игрушки для малышей >> Развивающие игрушки >> Развивающие игрушки Huile Toys,huile-toys,Інтерактивна іграшка пластикова Huile Toys Візок з морозивом (6101),,1065,1,https://comfy.ua/interaktivnaja-igrushka-plastikovaja-huile-toys-telezhka-s-morozhenym-6101.html,,05.11.2025 20:38,,"вул. Соборна, 42",Фастів,0
1091691241,7170819,MINOLA,Встраиваемая микроволновая печь MINOLA BWO 2011 WH,7199,1911110,Техника для кухни >> Крупная техника >> Микроволновые печи >> Микроволновые печи Minola,minola,Мікрохвильова піч (НВЧ) вбудовувана Minola BWO 2011 WH,,7199,1,https://comfy.ua/mikrovolnovaja-pech-svch-vstraivaemaja-minola-bwo-2011-wh.html,8999,05.11.2025 18:24,,"вул. Соборна, 42",Фастів,0
1091691258,7170820,PERFELLI,Встраиваемая микроволновая печь PERFELLI BM 205 GLB,6649,1911317,Техника для кухни >> Крупная техника >> Микроволновые печи >> Микроволновые печи Perfelli,perfelli,Мікрохвильова піч (НВЧ) вбудовувана Perfelli BM 205 GLB,,7499,1,https://comfy.ua/mikrovolnovaja-pech-svch-vstraivaemaja-perfelli-bm-205-glb.html,9999,05.11.2025 17:58,,"вул. Соборна, 42",Фастів,0
1091691275,6809798,PERFELLI,Встраиваемая микроволновая печь PERFELLI BM 205 GLW,7999,1911318,Техника для кухни >> Крупная техника >> Микроволновые печи >> Микроволновые печи Perfelli,perfelli,Мікрохвильова піч (НВЧ) вбудовувана Perfelli BM 205 GLW,,7999,1,https://comfy.ua/mikrovolnovaja-pech-svch-vstraivaemaja-perfelli-bm-205-glw.html,9999,05.11.2025 18:24,,"вул. Соборна, 42",Фастів,0
1091700978,,,,,1885712,Смартфоны и телефоны >> Аксессуары для смартфонов,promate,Мережевий зарядний пристрій Promate Powerport-33 Black,,799,1,https://comfy.ua/catalog/product/view/id/3304933,999,05.11.2025 17:32,,"вул. Соборна, 42",Фастів,0
1091700979,,,,,1885714,Смартфоны и телефоны >> Аксессуары для смартфонов,promate,Мережевий зарядний пристрій Promate Powerport-33 White,,799,1,https://comfy.ua/catalog/product/view/id/3304923,999,05.11.2025 17:38,,"вул. Соборна, 42",Фастів,0
1091704338,,,,,1909116,Посуда >> Для приготовления,ardesto,Набір посуду Ardesto AR1906SG Gemini Livorno 6 пр.,,1599,1,https://comfy.ua/nabor-posudy-ardesto-ar1906sg-gemini-livorno-6-pr.html,2449,05.11.2025 18:51,,"вул. Соборна, 42",Фастів,3
1091707223,6770012,FUJI,cam. FUJI Instax LINK WIDE M EX D GRAY,6799,1917702,"Ноутбуки, планшеты и компьютерная техника >> МФУ, принтеры и сканеры >> Принтеры и МФУ >> Принтеры и МФУ Fujifilm",fujifilm,Фотопринтер Fujifilm INSTAX Link Wide M Gray EX D (16719586),,7519,1,https://comfy.ua/fotoprinter-fujifilm-instax-link-wide-m-gray-ex-d-16719586.html,,05.11.2025 17:39,,"вул. Соборна, 42",Фастів,0
