1648672839,column,column,column,column,2806088,"Ноутбуки, планшеты и компьютерная техника >> Аксессуары для ноутбуков, планшетов и ПК",ugreen,_ugreen_us132_usb_20_male_to_mini_usb_5pin_male_cable_1m_black_10355,column,119,1,httpscomfyuakabelugreenus132usba20maletominiusb5pinmalecable1mblack10355html,column,05112025_1743,column,__42,Фастів,0
1648672800,,,,,2811649,Детские товары >> Игрушки >> Куклы и пупсы >> Куклы >> Куклы Perfumies,perfumies,Колекційна лялька Perfumies РОЗА ЛІ з аксесуарами (1263),,99,1,https://comfy.ua/kollekcionnaja-kukla-perfumies-roza-li-s-aksessuarami-1263.html,199,05.11.2025 23:11,,"вул. Соборна, 42",Фастів,0
1648672839,,,,,2806088,"Ноутбуки, планшеты и компьютерная техника >> Аксессуары для ноутбуков, планшетов и ПК",ugreen,Кабель UGREEN US132 USB-А 2.0 Male to Mini USB 5pin Male Cable 1m Black (10355),,119,1,https://comfy.ua/kabel-ugreen-us132-usb-a-2-0-male-to-mini-usb-5pin-male-cable-1m-black-10355.html,,05.11.2025 17:43,,"вул. Соборна, 42",Фастів,0
1648672848,,,,,2817312,Смартфоны и телефоны >> Мобильные телефоны,sigma-mobile,Мобільний телефон Sigma mobile X-style 34 NRG TYPE-C Black,,975,1,https://comfy.ua/mobil-nyj-telefon-sigma-mobile-x-style-34-nrg-type-c-black.html,,05.11.2025 17:15,,"вул. Соборна, 42",Фастів,0
1648672949,,,,,2697032,Инструменты и автотовары >> Ручные инструменты >> Тиски и струбцины >> Тиски и струбцины Milwaukee,milwaukee,Струбцина Milwaukee Torque Lock 1-76 мм (4932471733),,879,1,https://comfy.ua/strubcina-milwaukee-torque-lock-1-76-mm-4932471733.html,,05.11.2025 21:27,,"вул. Соборна, 42",Фастів,0
1648673323,,,,,.2784098,Красота и здоровье >> Уход за полостью рта,zelmer,Насадка для зубної щітки Zelmer ZTBA1010W,,399,1,https://comfy.ua/nasadka-dlja-zubnoj-schetki-zelmer-ztba1010w.html,,05.11.2025 18:43,,"вул. Соборна, 42",Фастів,0
1648673484,,,,,2814989,Красота и здоровье >> Уход за полостью рта >> Зубные щетки электрические и насадки >> Зубные щетки электрические и насадки Soocas,soocas,Насадка для зубної щітки Soocas D2/D3 Green,,464,1,https://comfy.ua/nasadka-dlja-zubnoj-schetki-soocas-d2-d3-green.html,499,05.11.2025 18:48,,"вул. Соборна, 42",Фастів,0
1648673485,,,,,2814988,Красота и здоровье >> Уход за полостью рта >> Зубные щетки электрические и насадки >> Зубные щетки электрические и насадки Soocas,soocas,Насадка для зубної щітки Soocas D2/D3 Pink,,499,1,https://comfy.ua/nasadka-dlja-zubnoj-schetki-soocas-d2-d3-pink.html,,05.11.2025 18:49,,"вул. Соборна, 42",Фастів,0
1648673674,,,,,2697033,Инструменты и автотовары >> Ручные инструменты >> Тиски и струбцины >> Тиски и струбцины Milwaukee,milwaukee,Струбцина Milwaukee 200 мм (4932471734),,1309,1,https://comfy.ua/strubcina-milwaukee-200-mm-4932471734.html,,05.11.2025 21:19,,"вул. Соборна, 42",Фастів,0
1648673751,6951160,SIEMENS,Кофемашина SIEMENS TP511R01,19999,2809914,Техника для кухни >> Мир кофе >> Кофемашины >> Кофемашины Siemens,siemens,Кавомашина Siemens TP511R01,,19999,1,https://comfy.ua/kofemashina-siemens-tp511r01.html,45149,05.11.2025 17:25,,"вул. Соборна, 42",Фастів,0
1648674031,7066691,FROSCH,Чистящее средство Frosch с виноградной кислотой 500 мл (1709851),167,2767881,Бытовая химия >> Все для уборки >> Средства для чистки ванной >> Средства для чистки ванной Frosch,frosch,Засіб для миття у ванній кімнаті Frosch Зелений виноград 500мл,,129,1,https://comfy.ua/sredstvo-dlja-myt-ja-v-vannoj-komnate-frosch-zelenyj-vinograd-500ml.html,209,05.11.2025 19:16,,"вул. Соборна, 42",Фастів,0
1648674257,,,,,.2814063,Детские товары >> Игрушки,minecraft,Настільна гра (5-7 років) Minecraft Quiz - The Independent and Unofficial Guide (WM01279-EN1-6),,299,1,https://comfy.ua/nastol-naja-igra-razvivajuschaja-5-7-let-minecraft-quiz-the-independent-and-unofficial-guide-wm01279-en1-6.html,,05.11.2025 22:19,,"вул. Соборна, 42",Фастів,0
1648675008,7054074,WINNING MOVES,Настольная игра WINNING MOVES DC COMICS Batman Cluedo (WM00839-EN1-6),1368,2814060,Детские товары >> Игрушки >> Настольные игры и головоломки >> Настольные игры и головоломки DC Comics,dc-comics,Настільна гра (8+) DC Comics Batman - Cluedo (WM00839-EN1-6),,1759,1,https://comfy.ua/nastol-naja-igra-kartochnaja-8-dc-comics-batman-cluedo-wm00839-en1-6.html,,05.11.2025 23:31,,"вул. Соборна, 42",Фастів,0
1648675009,,,,,.2814061,Детские товары >> Игрушки,winning-moves,Настільна гра (8+) Winning Moves James Bond 007 Cluedo (WM01312-EN1-6),,1299,1,https://comfy.ua/nastol-naja-igra-kartochnaja-8-james-bond-007-cluedo-wm01312-en1-6.html,,06.11.2025 0:34,,"вул. Соборна, 42",Фастів,0
1648675011,,,,,.2814062,Детские товары >> Игрушки,winning-moves,Настільна гра (12+) Winning Moves JIMI HENDRIX Monopoly (WM03131-EN1-6),,1545,1,https://comfy.ua/nastol-naja-igra-kartochnaja-8-jimi-hendrix-monopoly-wm03131-en1-6.html,,06.11.2025 0:34,,"вул. Соборна, 42",Фастів,0
1648675012,,,,,2811716,Comfy KIDS >> Игрушки >> Настольные игры и головоломки >> Настольные игры и головоломки Battat,battat,Настільна гра (3-4 роки) Battat Тутті-Фрутті (BX1778Z),,1745,1,https://comfy.ua/nastol-naja-igra-razvivajuschaja-3-4-goda-battat-tutti-frutti-bx1778z.html,,05.11.2025 22:45,,"вул. Соборна, 42",Фастів,0
1648675241,7038225,BEBE CONFORT,Детский аспиратор BEBE CONFORT (30307900),228,2811729,"Детские товары >> Уход, купание и гигиена >> Аптечка для малыша >> Аптечка для малыша Bebe Confort",bebe-confort,Аспіратор назальний дитячий Bebe Confort 30307900,,229,1,https://comfy.ua/aspirator-nazal-nyj-detskij-bebe-confort-30307900.html,,05.11.2025 20:48,,"вул. Соборна, 42",Фастів,0
1648675287,,,,,2810543,Красота и здоровье >> Уход за лицом >> Расходные материалы для электробритв >> Расходные материалы для электробритв Zelmer,zelmer,Змінні леза для бритви Zelmer ZSHA7500,,799,1,https://comfy.ua/smennye-lezvija-dlja-britvy-zelmer-zsha7500.html,,05.11.2025 18:46,,"вул. Соборна, 42",Фастів,0
1648675309,,,,,2807475,"Ноутбуки, планшеты и компьютерная техника >> Аксессуары для ноутбуков, планшетов и ПК",ugreen,Перехідник UGREEN US241 USB-C 2.0 to USB-B 2.0 Print Cable 2m Black (50446),,299,1,https://comfy.ua/perehodnik-ugreen-us241-usb-c-2-0-to-usb-b-2-0-print-cable-2m-black-50446.html,,05.11.2025 17:37,,"вул. Соборна, 42",Фастів,0
1648675975,,,,,2806089,"Ноутбуки, планшеты и компьютерная техника >> Аксессуары для ноутбуков, планшетов и ПК",ugreen,Кабель UGREEN VG101 VGA Male to Male Cable 1m Black (11673),,279,1,https://comfy.ua/kabel-ugreen-vg101-vga-male-to-male-cable-1m-black-11673.html,,05.11.2025 20:42,,"вул. Соборна, 42",Фастів,0
1648678201,7165787,SOLA,Нож десертный SOLA 19.9см (11LAUS114),241,2704756,Посуда >> Для сервировки >> Столовые приборы >> Столовые приборы Sola,sola,"Ніж десертний Sola 19,9 см 11LAUS114",,241,1,https://comfy.ua/nozh-desertnyj-sola-19-9-sm-11laus114.html,,05.11.2025 19:42,,"вул. Соборна, 42",Фастів,0
1648678439,7037808,MINIKOIOI,Пустышка MINIKOIO Sleep Buddy Moi (101010008),948,2811738,Детские товары >> Кормление >> Пустышки и прорезыватели >> Пустышки и прорезыватели MinikOiOi,minikoioi,Анатомічна пустушка MinikOiOi Sleep Buddy - Moi (101010008),,949,1,https://comfy.ua/anatomicheskaja-pustyshka-minikoioi-sleep-buddy-moi-101010008.html,,05.11.2025 21:06,,"вул. Соборна, 42",Фастів,0
1648682799,,,,,2754912,Детские товары >> Кормление >> Детская посуда и принадлежности >> Детская посуда и принадлежности Beaba,beaba,Набір дитячий Beaba Green/White NEW (913574),,780,1,https://comfy.ua/nabor-detskij-beaba-green-white-new-913574.html,,05.11.2025 21:11,,"вул. Соборна, 42",Фастів,0
1648683256,,,,,2754909,Детские товары >> Кормление >> Детская посуда и принадлежности >> Детская посуда и принадлежности Beaba,beaba,Набір тарілок для малюка Beaba Pink (913568),,1560,1,https://comfy.ua/nabor-tarelok-dlja-malysha-beaba-pink-913568.html,,05.11.2025 21:30,,"вул. Соборна, 42",Фастів,0
1648683518,,,,,2767886,Бытовая химия >> Средства для стирки,frosch,"Гель для прання Frosch Baby 1,5л",,464,1,https://comfy.ua/gel-dlja-stirki-frosch-baby-1-5l.html,663,05.11.2025 19:10,,"вул. Соборна, 42",Фастів,0
1648686371,,,,,.2811743,Детские товары >> Прогулки и поездки,osann,Дзеркало для контролю за дитиною Osann Black,,539,1,https://comfy.ua/zerkalo-dlja-kontrolja-za-rebenkom-osann-black.html,,05.11.2025 20:38,,"вул. Соборна, 42",Фастів,0
1648686372,7037340,CARSEATS,Органайзер на кресло CARSEATS (CS-0003),720,2811732,Детские товары >> Прогулки и поездки >> Автокресла и аксессуары для поездок >> Автокресла и аксессуары для поездок Carseats,carseats,Органайзер для автокрісла Carseats CS-0003,,720,1,https://comfy.ua/organajzer-dlja-avtokresla-carseats-cs-0003.html,,05.11.2025 20:43,,"вул. Соборна, 42",Фастів,0
1648686373,7038203,BEBE CONFORT,Защитный коврик для автокресла BEBE CONFORT Black (3203201200),840,2811730,Детские товары >> Прогулки и поездки >> Автокресла и аксессуары для поездок >> Автокресла и аксессуары для поездок Bebe Confort,bebe-confort,Захисний килимок під автокрісло Bebe Confort 3203201200 Black,,840,1,https://comfy.ua/zaschitnyj-kovrik-pod-avtokreslo-bebe-confort-3203201200-black.html,,05.11.2025 20:39,,"вул. Соборна, 42",Фастів,0
1648686374,,,,,2811731,Comfy KIDS >> Прогулки и поездки >> Автокресла и аксессуары для поездок >> Автокресла и аксессуары для поездок Bebe Confort,bebe-confort,Дзеркало для контролю за дитиною Bebe Confort 3203205000 Black,,750,1,https://comfy.ua/zerkalo-dlja-kontrolja-za-rebenkom-bebe-confort-3203205000-black.html,,05.11.2025 20:41,,"вул. Соборна, 42",Фастів,0
1648686377,7037335,OKIDAY,Вкладыш OKIDAY Basic (21906),1560,2811742,Детские товары >> Прогулки и поездки >> Автокресла и аксессуары для поездок >> Автокресла и аксессуары для поездок OkiDay,okiday,Вкладиш в автокрісло OkiDay 21906,,1560,1,https://comfy.ua/vkladysh-v-avtokreslo-okiday-21906.html,,05.11.2025 20:53,,"вул. Соборна, 42",Фастів,0
1648690353,,,,,2809928,Детские товары >> Прогулки и поездки >> Автокресла и аксессуары для поездок >> Автокресла и аксессуары для поездок Maxi-Cosi,maxi-cosi,Автокрісло Maxi-Cosi RodiFix M i-Size Basic Black,,6780,1,https://comfy.ua/avtokreslo-maxi-cosi-rodifix-m-i-size-basic-black.html,,05.11.2025 20:23,,"вул. Соборна, 42",Фастів,0
1648690354,,,,,2809926,Детские товары >> Прогулки и поездки,maxi-cosi,Автокрісло Maxi-Cosi RodiFix R i-Size Authentic Graphite,,6900,1,https://comfy.ua/avtokreslo-maxi-cosi-rodifix-r-i-size-authentic-graphite.html,,05.11.2025 20:51,,"вул. Соборна, 42",Фастів,0
1648691344,6949974,MASTERPRO,Набор столовых приборов MASTERPRO Foodies collection 4 предмета (BGEU-3952),1039,2799495,Посуда >> Для сервировки >> Столовые приборы >> Столовые приборы Masterpro,masterpro,Набір столових приборів Masterpro Foodies collection 4 пр. (BGEU-3952),,1039,1,https://comfy.ua/nabor-stolovyh-priborov-masterpro-foodies-collection-4-pr-bgeu-3952.html,1289,05.11.2025 19:23,,"вул. Соборна, 42",Фастів,0
1648691381,,,,,.2797416,Смартфоны и телефоны >> Аксессуары для смартфонов,devia,Захисна плівка для смартфону DEVIA for Honor Magic5 матова (DV-HNR-MG5M),,199,1,https://comfy.ua/zaschitnaja-plenka-dlja-smartfona-devia-for-honor-magic5-matovaja-dv-hnr-mg5m.html,,05.11.2025 20:29,,"вул. Соборна, 42",Фастів,0
1648691382,,,,,.2797437,Смартфоны и телефоны >> Аксессуары для смартфонов,devia,Захисна плівка для смартфону DEVIA for Samsung A25 (DV-SM-A25),,199,1,https://comfy.ua/zaschitnaja-plenka-dlja-smartfona-devia-for-samsung-a25-dv-sm-a25.html,,05.11.2025 20:29,,"вул. Соборна, 42",Фастів,0
1648691384,,,,,.2797644,Смартфоны и телефоны >> Аксессуары для смартфонов,devia,Захисна плівка для смартфону DEVIA for ZTE Blade L220 матова (DV-ZT-BDAL220M),,199,1,https://comfy.ua/zaschitnaja-plenka-dlja-smartfona-devia-for-zte-blade-l220-matovaja-dv-zt-bdal220m.html,,05.11.2025 20:28,,"вул. Соборна, 42",Фастів,0
1648691385,,,,,.2797646,Смартфоны и телефоны >> Аксессуары для смартфонов,devia,Захисна плівка для смартфону DEVIA for ZTE Blade L9 (DV-ZT-BDAL9),,199,1,https://comfy.ua/zaschitnaja-plenka-dlja-smartfona-devia-for-zte-blade-l9-dv-zt-bdal9.html,,05.11.2025 20:28,,"вул. Соборна, 42",Фастів,0
1648691386,,,,,.2797634,Смартфоны и телефоны >> Аксессуары для смартфонов,devia,Захисна плівка для смартфону DEVIA for Xiaomi redmi Note 12s (DV-XM-RMN12S),,199,1,https://comfy.ua/zaschitnaja-plenka-dlja-smartfona-devia-for-xiaomi-redmi-note-12s-dv-xm-rmn12s.html,,05.11.2025 20:28,,"вул. Соборна, 42",Фастів,0
1648691387,,,,,.2797630,Смартфоны и телефоны >> Аксессуары для смартфонов,devia,Захисна плівка для смартфону DEVIA for Samsung S23 FE (DV-SM-S23FE),,199,1,https://comfy.ua/zaschitnaja-plenka-dlja-smartfona-devia-for-samsung-s23-fe-dv-sm-s23fe.html,,05.11.2025 20:28,,"вул. Соборна, 42",Фастів,0
1648691388,,,,,.2797439,Смартфоны и телефоны >> Аксессуары для смартфонов,devia,Захисна плівка для смартфону DEVIA for Samsung A25 матова (DV-SM-A25M),,199,1,https://comfy.ua/zaschitnaja-plenka-dlja-smartfona-devia-for-samsung-a25-matovaja-dv-sm-a25m.html,,05.11.2025 20:29,,"вул. Соборна, 42",Фастів,0
1648691731,,,,,2765744,Смартфоны и телефоны >> Аксессуары для смартфонов,gelius,"Захисне скло для смартфону Gelius Full Cover Ultra-Thin 0,25 мм for Samsung Note 10 Lite Black (95069)",,249,1,https://comfy.ua/zaschitnoe-steklo-dlja-smartfona-gelius-full-cover-ultra-thin-0-25-mm-for-samsung-note-10-lite-black-95069.html,,05.11.2025 18:10,,"вул. Соборна, 42",Фастів,0
1648691732,,,,,.2778236,Смартфоны и телефоны >> Аксессуары для смартфонов,armorstandart,Захисна плівка для смартфону Armorstandart Matte for Realme 11 Pro+ (ARM69177),,209,1,https://comfy.ua/zaschitnaja-plenka-dlja-smartfona-armorstandart-matte-for-realme-11-pro-arm69177.html,,05.11.2025 20:33,,"вул. Соборна, 42",Фастів,0
1648692050,6919677,EINHELL,Кейс для инструмента EINHELL E-Case S-F (4540011),1529,2781227,Инструменты и автотовары >> Расходные материалы >> Ящики для инструментов >> Ящики для инструментов Einhell,einhell,Органайзер для інструментів Einhell E-Case S-F (4540011),,1529,1,https://comfy.ua/organajzer-dlja-instrumentov-einhell-e-case-s-f-4540011.html,,05.11.2025 21:22,,"вул. Соборна, 42",Фастів,0
1648695035,6919772,NEO TOOLS,Линейка NEO TOOLS 30см (72-200),399,2460670,Инструменты и автотовары >> Ручные инструменты >> Уровни >> Уровни Neo Tools,neo-tools,Лінійка Neo Tools 30 см (72-200),,399,1,https://comfy.ua/linejka-neo-tools-30-sm-72-200.html,,05.11.2025 22:11,,"вул. Соборна, 42",Фастів,0
1648695036,,,,,2699229,Инструменты и автотовары >> Ручные инструменты >> Уровни >> Уровни Haisser,haisser,Рівень Haisser Heavy Duty 600 мм (26046),,1059,1,https://comfy.ua/uroven-haisser-heavy-duty-600-mm-26046.html,,05.11.2025 21:27,,"вул. Соборна, 42",Фастів,0
1648695058,,,,,2811722,Детские товары >> Подгузники и пеленание >> Подгузники >> Подгузники Goo.N,goon,"Одноразові підгузки Goo.N Plus (М, 6-11 кг, 56 шт.) (21000628)",,1099,1,https://comfy.ua/odnorazovye-podguzniki-goo-n-plus-m-6-11-kg-56-sht-21000628.html,1349,05.11.2025 20:34,,"вул. Соборна, 42",Фастів,0
1648695113,7060369,OXO,Водосгон OXO для окон (1062122),525,2811537,Бытовая химия >> Все для уборки >> Щетки для уборки >> Щетки для уборки OXO,oxo,Щітка для миття скла OXO 1062122,,525,1,https://comfy.ua/schetka-dlja-mojki-stekla-oxo-1062122.html,,05.11.2025 19:36,,"вул. Соборна, 42",Фастів,0
1648695114,7060389,OXO,Набор для уборки Oxo Cleaning Products (1334480),765,2811536,Бытовая химия >> Все для уборки >> Щетки для уборки >> Щетки для уборки OXO,oxo,Щітка для прибирання OXO з контейнером 7x24x32 см (1334480),,765,1,https://comfy.ua/schetka-dlja-uborki-oxo-s-kontejnerom-7x24x32-sm-1334480.html,,05.11.2025 19:37,,"вул. Соборна, 42",Фастів,0
1648695227,,,,,.2784303,Смартфоны и телефоны >> Аксессуары для смартфонов,armorstandart,Захисна плівка для смартфону Armorstandart for Sigma mobile X-treme PQ39 Ultra (ARM71046),,209,1,https://comfy.ua/zaschitnaja-plenka-dlja-smartfona-armorstandart-for-sigma-mobile-x-treme-pq39-ultra-arm71046.html,,05.11.2025 20:30,,"вул. Соборна, 42",Фастів,0
1648695228,,,,,.2780114,Смартфоны и телефоны >> Аксессуары для смартфонов,armorstandart,Захисна плівка для смартфону Armorstandart for Oppo Reno5 (ARM59499),,209,1,https://comfy.ua/zaschitnaja-plenka-dlja-smartfona-armorstandart-for-oppo-reno5-arm59499.html,,05.11.2025 20:05,,"вул. Соборна, 42",Фастів,0
1648695230,,,,,.2800154,Смартфоны и телефоны >> Аксессуары для смартфонов,armorstandart,Захисна плівка для смартфону Armorstandart Matte for Infinix Smart 8 (ARM73228),,209,1,https://comfy.ua/zaschitnaja-plenka-dlja-smartfona-armorstandart-matte-for-infinix-smart-8-arm73228.html,,05.11.2025 20:27,,"вул. Соборна, 42",Фастів,0
1648695232,,,,,.2782151,Смартфоны и телефоны >> Аксессуары для смартфонов,armorstandart,Захисна плівка для смартфону Armorstandart for Oukitel WP5 Pro (ARM73633),,209,1,https://comfy.ua/zaschitnaja-plenka-dlja-smartfona-armorstandart-for-oukitel-wp5-pro-arm73633.html,,05.11.2025 20:30,,"вул. Соборна, 42",Фастів,0
1648695236,,,,,.2782144,Смартфоны и телефоны >> Аксессуары для смартфонов,armorstandart,Захисна плівка для смартфону Armorstandart for Blackview A95 (ARM64644),,209,1,https://comfy.ua/zaschitnaja-plenka-dlja-smartfona-armorstandart-for-blackview-a95-arm64644.html,,05.11.2025 20:04,,"вул. Соборна, 42",Фастів,0
1648695237,,,,,.2782147,Смартфоны и телефоны >> Аксессуары для смартфонов,armorstandart,Захисна плівка для смартфону Armorstandart for TCL 20L (T774H) / 20L+ (T775H) (ARM65042),,209,1,https://comfy.ua/zaschitnaja-plenka-dlja-smartfona-armorstandart-for-tcl-20l-t774h-20l-t775h-arm65042.html,,05.11.2025 20:04,,"вул. Соборна, 42",Фастів,0
1648695239,,,,,.2782150,Смартфоны и телефоны >> Аксессуары для смартфонов,armorstandart,Захисна плівка для смартфону Armorstandart for Oukitel WP20 (ARM73631),,209,1,https://comfy.ua/zaschitnaja-plenka-dlja-smartfona-armorstandart-for-oukitel-wp20-arm73631.html,,05.11.2025 20:30,,"вул. Соборна, 42",Фастів,0
1648695240,,,,,.2782148,Смартфоны и телефоны >> Аксессуары для смартфонов,armorstandart,Захисна плівка для смартфону Armorstandart for Blackview BV8800 (ARM72603),,209,1,https://comfy.ua/zaschitnaja-plenka-dlja-smartfona-armorstandart-for-blackview-bv8800-arm72603.html,,05.11.2025 20:30,,"вул. Соборна, 42",Фастів,0
1648695801,6947996,XIAOMI,Смартфон XIAOMI Redmi Note 13 Pro+ 5G 8/256GB Midnight Black (1020570),13948,2813525,Смартфоны и телефоны >> Смартфоны,xiaomi,Смартфон Xiaomi Redmi Note 13 Pro+ 5G 8/256Gb Midnight Black,,13299,1,https://comfy.ua/smartfon-xiaomi-redmi-note-13-pro-5g-8-256gb-midnight-black-8950483.html,,05.11.2025 17:45,,"вул. Соборна, 42",Фастів,0
