752439844,6611209,GOKI,Настольная игра GOKI Лото Разноцветный мир II (56813G),473,1592479,Детские товары >> Игрушки >> Настольные игры и головоломки >> Настольные игры и головоломки goki,goki,Настільна гра (3-4 роки) goki Лото Різнобарвний світ II (56813G),,475,1,https://comfy.ua/nastol-naja-igra-goki-loto-raznocvetnyj-mir-ii-56813g.html,,06.11.2025 1:40,,"вул. Соборна, 42",Фастів,0
752439852,6439622,GOKI,Лото GOKI Разноцветный мир (56705),600,1592475,Детские товары >> Игрушки >> Настольные игры и головоломки >> Настольные игры и головоломки goki,goki,Настільна гра (3-4 роки) goki Лото Різнобарвний світ (56705),,599,1,https://comfy.ua/nastol-naja-igra-goki-loto-raznocvetnyj-mir-56705.html,,06.11.2025 1:03,,"вул. Соборна, 42",Фастів,0
752439859,6611297,GOKI,Пазл-вкладыш вертикальный GOKI пожарная команда (57471G),227,1592755,Детские товары >> Игрушки >> Пазлы >> Пазлы goki,goki,"Пазли (3-4 роки) goki Пожежна команда, вертикальний (57471G)",,299,1,https://comfy.ua/pazl-vkladysh-goki-pozharnaja-komanda-vertikal-nyj-57471g.html,,06.11.2025 1:43,,"вул. Соборна, 42",Фастів,0
752439875,6611286,GOKI,Пазл-вкладыш GOKI Ручки (57875G),214,1592747,Детские товары >> Игрушки,goki,Головоломка goki Ручки (57875G),,225,1,https://comfy.ua/pazl-vkladysh-goki-ruchki-57875g.html,,06.11.2025 0:24,,"вул. Соборна, 42",Фастів,0
752439891,6611408,JANOD,Настольная игра JANOD 5 в 1 (J02742),1259,1592503,Детские товары >> Игрушки >> Настольные игры и головоломки >> Настольные игры и головоломки Janod,janod,Настільна гра (5-7 років) Janod 5 в 1 (J02742),,1465,1,https://comfy.ua/nastol-naja-igra-janod-5-v-1-j02742.html,,06.11.2025 1:07,,"вул. Соборна, 42",Фастів,0
752439895,6611517,JANOD,Пазл тактильный Janod День в зоопарке 20 эл (J02774),929,1592596,Детские товары >> Игрушки,janod,Пазли (3-4 роки) Janod День в зоопарку 20 ел. (J02774),,929,1,https://comfy.ua/pazl-taktil-nyj-janod-den-v-zooparke-20-jel-j02774.html,,06.11.2025 1:47,,"вул. Соборна, 42",Фастів,0
752439900,6440460,JANOD,Настольная игра JANOD Монстры (J02739),340,1592500,Детские товары >> Игрушки >> Настольные игры и головоломки >> Настольные игры и головоломки Janod,janod,Настільна гра (5-7 років) Janod Монстри (J02739),,339,1,https://comfy.ua/nastol-naja-igra-janod-monstry-j02739.html,,06.11.2025 1:18,,"вул. Соборна, 42",Фастів,0
752439904,6611519,JANOD,Пазл тактильный JANOD Жизнь на льду (J02773),713,1592594,Comfy KIDS >> Игрушки >> Пазлы >> Пазлы Janod,janod,Пазли (3-4 роки) Janod Життя на льоду 20 ел. (J02773),,795,1,https://comfy.ua/pazl-taktil-nyj-janod-zhizn-na-l-du-20-jel-j02773.html,,06.11.2025 1:43,,"вул. Соборна, 42",Фастів,0
752439911,6611518,JANOD,Пазл тактильный JANOD Животные на ферме (J02772),929,1592592,Comfy KIDS >> Игрушки >> Пазлы >> Пазлы Janod,janod,Пазли (3-4 роки) Janod Тварини на фермі 20 ел. (J02772),,929,1,https://comfy.ua/pazl-taktil-nyj-janod-zhivotnye-na-ferme-20-jel-j02772.html,,06.11.2025 1:43,,"вул. Соборна, 42",Фастів,0
