756007800,column,column,column,column,1720397,Детские товары >> Игрушки,sigikid,__sigikid_____19__39183sk,column,1095,1,httpscomfyuamjagkajaigrushkazhivotnoesigikidbozhjakorovkaledimjeri19sm39183skhtml,column,06112025_138,column,__42,Фастів,0
756007800,,,,,.1720397,Детские товары >> Игрушки,sigikid,М'яка іграшка Sigikid Божа корівка Леді Мері 19 см (39183SK),,1095,1,https://comfy.ua/mjagkaja-igrushka-zhivotnoe-sigikid-bozh-ja-korovka-ledi-mjeri-19-sm-39183sk.html,,06.11.2025 1:38,,"вул. Соборна, 42",Фастів,0
756007802,,,,,.1720396,Детские товары >> Игрушки,sigikid,М'яка іграшка Sigikid Beasts Коза Дереза ??37 см (39182SK),,1999,1,https://comfy.ua/mjagkaja-igrushka-zhivotnoe-sigikid-beasts-koza-dereza-37-sm-39182sk.html,,06.11.2025 1:38,,"вул. Соборна, 42",Фастів,0
756007844,,,,,1719471,Детские товары >> Игрушки >> Пазлы >> Пазлы Trefl,trefl,Пазли (8 +) Trefl Солодощі 1000 ел. (29046),,279,1,https://comfy.ua/pazly-kartonnye-8-trefl-sladosti-1000-jel-29046.html,,06.11.2025 1:39,,"вул. Соборна, 42",Фастів,0
756007855,7109897,TREFL,Пазл TREFL The Avengers В мире Мстителей 24 элемента (14321),299,1715432,Детские товары >> Игрушки >> Пазлы >> Пазлы Trefl,trefl,Пазли (3-4 роки) Trefl У світі месників 24 Елм. MAXI (14321),,305,1,https://comfy.ua/pazly-kartonnye-3-4-goda-trefl-v-mire-mstitelej-24-jelm-maxi-14321.html,,06.11.2025 1:29,,"вул. Соборна, 42",Фастів,0
756007904,6622831,GORENJE,Варочная поверхность GORENJE GW641EXB,11999,1714452,Техника для кухни >> Крупная техника >> Варочные панели >> Варочные панели Gorenje,gorenje,Варильна поверхня газова Gorenje GW 641 EXB,,11799,1,https://comfy.ua/varochnaja-panel-gazovaja-gorenje-gw-641-exb.html,12499,05.11.2025 21:08,,"вул. Соборна, 42",Фастів,0
756007941,6643115,GORENJE,Варочная поверхность GORENJE GT 642 AXW (BG6BA-G0B),13399,1713574,Техника для кухни >> Крупная техника >> Варочные панели >> Варочные панели Gorenje,gorenje,Варильна поверхня газова Gorenje GT642AXW,,13399,1,https://comfy.ua/varochnaja-panel-gazovaja-gorenje-gt642axw.html,13999,05.11.2025 19:12,,"вул. Соборна, 42",Фастів,0
756007950,6630981,ECG,Электрочайник ECG RK 2020 White Glass,1025,1716927,Техника для кухни >> Мелкая техника >> Чайники электрические >> Чайники электрические ECG,ecg,Електричний чайник ECG RK 2020 White Glass,,1025,1,https://comfy.ua/jelektricheskij-chajnik-ecg-rk-2020-white-glass.html,,05.11.2025 20:14,,"вул. Соборна, 42",Фастів,0
756007952,6630976,ECG,Электрочайник ECG RK 1758 Grey,823,1716922,Техника для кухни >> Мелкая техника >> Чайники электрические >> Чайники электрические ECG,ecg,Електричний чайник ECG RK 1758 Grey,,825,1,https://comfy.ua/jelektricheskij-chajnik-ecg-rk-1758-grey.html,,05.11.2025 20:19,,"вул. Соборна, 42",Фастів,0
756007953,6630974,ECG,Электрочайник ECG RK 1520 Glass,998,1716921,Техника для кухни >> Мелкая техника >> Чайники электрические >> Чайники электрические ECG,ecg,Електричний чайник ECG RK 1520 Glass,,999,1,https://comfy.ua/jelektricheskij-chajnik-ecg-rk-1520-glass.html,,05.11.2025 20:14,,"вул. Соборна, 42",Фастів,0
756007958,6645286,ECG,Утюг ECG NZ 190,1049,1716912,Техника для дома >> Мелкая техника >> Утюги >> Утюги ECG,ecg,Праска ECG NZ 190,,1049,1,https://comfy.ua/utjug-ecg-nz-190.html,,05.11.2025 18:52,,"вул. Соборна, 42",Фастів,0
756008837,,,,,1038661,Бытовая химия >> Для кухни и мытья посуды,freken-bok,"Засіб для ручного миття посуду Фрекен Бок Лимон та олива 0,5 л",,75,1,https://comfy.ua/chistjaschee-sredstvo-dlja-myt-ja-posudy-freken-bok-limon-ta-oliva-0-5-l.html,,05.11.2025 19:43,,"вул. Соборна, 42",Фастів,0
756008840,6369469,CLIN,Средство для мытья окон и стекла Clin Голубой пистолет 500 мл,149,1713480,Бытовая химия >> Все для уборки >> Средства для мытья окон >> Средства для мытья окон Clin,clin,Засіб для чищення скла Clin Голубой пистолет 500 мл (9000100865760),,103,1,https://comfy.ua/chistjaschee-sredstvo-dlja-stekla-clin-goluboj-pistolet-500-ml-9000100865760.html,125,05.11.2025 19:14,,"вул. Соборна, 42",Фастів,0
756008841,7005921,ФРЕКЕН БОК,Средство для мытья полов Фрекен Бок GO GREEN Клевер 1л (4823071628937),106,1716486,Бытовая химия >> Все для уборки >> Средства для мытья пола >> Средства для мытья пола Фрекен Бок,freken-bok,Засіб для чищення універсальний Фрекен Бок для підлоги Клевер 1 л (4823071628937),,105,1,https://comfy.ua/chistjaschee-sredstvo-universal-noe-freken-bok-dlja-pola-klever-1-l-4823071628937.html,135,05.11.2025 19:12,,"вул. Соборна, 42",Фастів,0
756010592,,,,,.1713063,Бытовая химия >> Для кухни и мытья посуды,lion,Засіб для ручного миття посуду Lion Baking Soda&Citric Аcid Запаcка 1.2 л,,299,1,https://comfy.ua/chistjaschee-sredstvo-dlja-myt-ja-posudy-lion-baking-soda-citric-acid-zapacka-1-2-l.html,,05.11.2025 19:45,,"вул. Соборна, 42",Фастів,0
756010929,6635746,BOSCH,Ящик для инструментов BOSCH SystemBox M (1.600.A01.SR4),1230,1662218,Инструменты и автотовары >> Расходные материалы >> Ящики для инструментов >> Ящики для инструментов Bosch,bosch,Ящик для інструментів Bosch SystemBox M (1.600.A01.SR4),,1229,1,https://comfy.ua/jaschik-dlja-instrumentov-bosch-systembox-m-1-600-a01-sr4.html,,05.11.2025 22:09,,"вул. Соборна, 42",Фастів,0
756038669,,,,,.1695390,Посуда >> Кухонные аксессуары,tescoma,Ніж консервний tescoma 638646 President,,1549,1,https://comfy.ua/nozh-konservnyj-tescoma-638646-president.html,,05.11.2025 19:47,,"вул. Соборна, 42",Фастів,0
756038680,6705182,GEFU,Консервный ключ GEFU PRIMELINE (29237),1848,1713580,Посуда >> Кухонные аксессуары >> Штопоры и открывалки >> Штопоры и открывалки Gefu,gefu,Ніж консервний Gefu Primeline (29237),,1957,1,https://comfy.ua/nozh-konservnyj-gefu-primeline-29237.html,,05.11.2025 19:40,,"вул. Соборна, 42",Фастів,0
756187871,,,,,1704731,Дом и отдых >> Хранение и уход за одеждой >> Вешалки и чехлы для одежды >> Вешалки и чехлы для одежды Мій Дім,mij-dim,Вішалка Мой Дом RE01498 с прищепками 30х11 см (6584563),,99,1,https://comfy.ua/veshalka-moj-dom-re01498-s-prischepkami-30h11-sm-6584563.html,,05.11.2025 20:01,,"вул. Соборна, 42",Фастів,0
756187874,6584562,IDEA HOME,Вешалка IDEA HOME RE01497,55,1704730,"Дом, отдых и зоотовары >> Хранение и уход за одеждой >> Вешалки и чехлы для одежды >> Вешалки и чехлы для одежды Мій Дім",mij-dim,Вішалка Мой Дом RE01497 Детская д/од. 33.5x20x1.2 см (6584562),,75,1,https://comfy.ua/veshalka-moj-dom-re01497-detskaja-d-od-33-5x20x1-2-sm-6584562.html,,05.11.2025 20:02,,"вул. Соборна, 42",Фастів,0
756187877,6584565,IDEA HOME,Вешалка IDEA HOME RE01499,65,1710573,"Дом, отдых и зоотовары >> Хранение и уход за одеждой >> Вешалки и чехлы для одежды >> Вешалки и чехлы для одежды Мій Дім",mij-dim,Вішалка Мой Дом RE01499 с крючками 45х20x1.2 см (6584565),,85,1,https://comfy.ua/veshalka-moj-dom-re01499-s-krjuchkami-45h20x1-2-sm-6584565.html,,05.11.2025 20:02,,"вул. Соборна, 42",Фастів,0
756187881,6584561,IDEA HOME,Вешалка IDEA HOME RE05240,149,1704729,"Дом, отдых и зоотовары >> Хранение и уход за одеждой >> Вешалки и чехлы для одежды >> Вешалки и чехлы для одежды Мій Дім",mij-dim,Вішалка Мой Дом RE05240 д/од. 45х23х5 см (6584561),,219,1,https://comfy.ua/veshalka-moj-dom-re05240-d-od-45h23h5-sm-6584561.html,,05.11.2025 19:59,,"вул. Соборна, 42",Фастів,0
756212198,,,,,1716318,Техника для дома >> Климатическая техника >> Терморегуляторы >> Терморегуляторы Terneo,terneo,Терморегулятор Terneo RTP White,,695,1,https://comfy.ua/termoreguljator-terneo-rtp-white.html,,05.11.2025 18:31,,"вул. Соборна, 42",Фастів,0
756212208,,,,,1716324,Техника для дома >> Климатическая техника,terneo,Терморегулятор Terneo SN,,1399,1,https://comfy.ua/termoreguljator-terneo-sn.html,,05.11.2025 18:28,,"вул. Соборна, 42",Фастів,0
756240482,6678040,WEILOR,Варочная поверхность WEILOR GM 304 WH,4999,1686191,Техника для кухни >> Крупная техника >> Варочные панели >> Варочные панели Weilor,weilor,Варильна поверхня Domino Weilor GM 304 WH,,4999,1,https://comfy.ua/varochnaja-panel-domino-weilor-gm-304-wh.html,,05.11.2025 21:18,,"вул. Соборна, 42",Фастів,0
756271108,,,,,1720179,"Инструменты и автотовары >> Ручные инструменты >> Плоскогубцы, пассатижи, кусачки >> Плоскогубцы, пассатижи, кусачки Stark",stark,Плоскогубці Stark 180 мм (501100180),,275,1,https://comfy.ua/ploskogubcy-stark-180-mm-501100180.html,,05.11.2025 22:36,,"вул. Соборна, 42",Фастів,0
756272261,6867281,STARK,Ножовка по дереву STARK 350 мм (507350007),161,1720187,"Инструменты и автотовары >> Ручные инструменты >> Ножовки, пилы и полотна >> Ножовки, пилы и полотна Stark",stark,Ножівка Stark 507350007,,169,1,https://comfy.ua/nozhovka-stark-507350007.html,,05.11.2025 21:42,,"вул. Соборна, 42",Фастів,0
756272262,6867282,STARK,Ножовка по дереву Stark 400 мм (507400007),179,1720188,"Инструменты и автотовары >> Ручные инструменты >> Ножовки, пилы и полотна >> Ножовки, пилы и полотна Stark",stark,Ножівка Stark 507400007,,179,1,https://comfy.ua/nozhovka-stark-507400007.html,,05.11.2025 22:36,,"вул. Соборна, 42",Фастів,0
756273281,,,,,1716990,Красота и здоровье >> Уход за волосами,remington,Вирівнювач волосся Remington CI89H1 HYDRAluxe,,2179,1,https://comfy.ua/catalog/product/view/id/1770773,2499,05.11.2025 19:09,,"вул. Соборна, 42",Фастів,0
756273329,6645228,ECG,Триммер ECG ZS 2020N,353,1716952,Красота и здоровье >> Уход за лицом >> Триммеры >> Триммеры ECG,ecg,Тример для носа і вух ECG ZS 2020N,,355,1,https://comfy.ua/trimmer-dlja-nosa-i-ushej-ecg-zs-2020n.html,,05.11.2025 18:50,,"вул. Соборна, 42",Фастів,0
756277751,,,,,1716996,Красота и здоровье >> Уход за волосами,remington,Вирівнювач волосся Remington S7307 Aqualisse Extreme,,2549,1,https://comfy.ua/catalog/product/view/id/1770783,2999,05.11.2025 19:11,,"вул. Соборна, 42",Фастів,0
756278179,,,,,1713692,"Ноутбуки, планшеты и компьютерная техника >> Аксессуары для ноутбуков, планшетов и ПК >> Кабели и переходники >> Кабели и переходники Colorway",colorway,Кабель синхронізації даних Colorway USB - Apple Lightning Zinc Alloy + Led 2.4А 1 м Black (CW-CBUL035-BK),,259,1,https://comfy.ua/kabel-sinhronizacii-dannyh-colorway-usb-2-0-am-to-lightning-1-0m-zinc-alloy-led-black-cw-cbul035-bk.html,,05.11.2025 19:28,,"вул. Соборна, 42",Фастів,0
756278180,,,,,1713690,"Ноутбуки, планшеты и компьютерная техника >> Аксессуары для ноутбуков, планшетов и ПК >> Кабели и переходники >> Кабели и переходники Colorway",colorway,Кабель синхронізації даних Colorway USB 2.0 AM to Lightning 2.0m Mint (CW-CBUL007-MT),,199,1,https://comfy.ua/kabel-sinhronizacii-dannyh-colorway-usb-2-0-am-to-lightning-2-0m-mint-cw-cbul007-mt.html,,05.11.2025 19:09,,"вул. Соборна, 42",Фастів,0
756278181,,,,,1713699,"Ноутбуки, планшеты и компьютерная техника >> Аксессуары для ноутбуков, планшетов и ПК >> Кабели и переходники >> Кабели и переходники Colorway",colorway,Кабель синхронізації даних Colorway USB 2.0 AM to Type-C 2.0m Mint (CW-CBUC008-MT),,199,1,https://comfy.ua/kabel-sinhronizacii-dannyh-colorway-usb-2-0-am-to-type-c-2-0m-mint-cw-cbuc008-mt.html,,05.11.2025 17:42,,"вул. Соборна, 42",Фастів,1
756278183,,,,,1718822,"Ноутбуки, планшеты и компьютерная техника >> Аксессуары для ноутбуков, планшетов и ПК >> Кабели и переходники >> Кабели и переходники Intaleo",intaleo,Кабель Intaleo CBFLEXM3 USB-microUSB 3m Black (1283126487491),,239,1,https://comfy.ua/kabel-intaleo-cbflexm3-usb-microusb-3m-black-1283126487491.html,,05.11.2025 19:07,,"вул. Соборна, 42",Фастів,0
756278925,,,,,1716899,Техника для кухни >> Мир кофе,ecg,Кавоварка крапельна ECG KP 2115 Black,,2059,1,https://comfy.ua/catalog/product/view/id/1766763,,05.11.2025 17:54,,"вул. Соборна, 42",Фастів,0
756279221,6661880,RUSSELL HOBBS,Кофеварка RUSSELL HOBBS 27010-56/RH,3032,1715585,Техника для кухни >> Мир кофе >> Кофеварки капельные >> Кофеварки капельные Russell Hobbs,russell-hobbs,Кавоварка крапельна Russell Hobbs 27010-56 Honeycomb White,,2999,1,https://comfy.ua/kofevarka-kapel-naja-russell-hobbs-27010-56-honeycomb-white.html,,05.11.2025 17:53,,"вул. Соборна, 42",Фастів,0
756279222,6661881,RUSSELL HOBBS,Кофеварка RUSSELL HOBBS 27011-56/RH,2499,1715587,Техника для кухни >> Мир кофе >> Кофеварки капельные >> Кофеварки капельные Russell Hobbs,russell-hobbs,Кавоварка крапельна Russell Hobbs 27011-56 Honeycomb Black,,2499,1,https://comfy.ua/kofevarka-kapel-naja-russell-hobbs-27011-56-honeycomb-black.html,3599,05.11.2025 17:53,,"вул. Соборна, 42",Фастів,0
756279300,,,,,1171504,Техника для кухни >> Мелкая техника,sencor,Соковитискач шнековий Sencor SSJ4041BK,,3899,1,https://comfy.ua/catalog/product/view/id/1770833,,05.11.2025 18:38,,"вул. Соборна, 42",Фастів,0
756279793,6815974,RUSSELL HOBBS,Соковыжималка RUSSELL HOBBS 26010-56 Colours Plus+ Red (26010-56),1999,1715672,Техника для кухни >> Мелкая техника >> Соковыжималки >> Соковыжималки Russell Hobbs,russell-hobbs,Цитрус-прес Russell Hobbs 26010-56 Colours Plus Red,,1999,1,https://comfy.ua/citrus-press-russell-hobbs-26010-56-colours-plus-red.html,2499,05.11.2025 18:35,,"вул. Соборна, 42",Фастів,0
756282367,,,,,1717908,"Посуда >> Нарезка и измельчение >> Терки, шинковки >> Терки, шинковки de Buyer",de-buyer,Овочерізка de Buyer Mandoline 2014.00,,9189,1,https://comfy.ua/ovoscherezka-de-buyer-mandoline-2014-00.html,,05.11.2025 19:37,,"вул. Соборна, 42",Фастів,0
756308517,,,,,1667730,Техника для дома >> Аксессуары к мелкой технике,rowenta,Фільтр для пилососа Rowenta ZR009002,,529,1,https://comfy.ua/fil-tr-dlja-pylesosa-rowenta-zr009002.html,,05.11.2025 18:08,,"вул. Соборна, 42",Фастів,0
756314757,,,,,1710649,Посуда >> Для приготовления >> Наборы посуды >> Наборы посуды Sola,sola,Набір посуду Sola 4 шт. 13PEARL 004,,12839,1,https://comfy.ua/nabor-posudy-sola-4-sht-13pearl-004.html,,05.11.2025 20:35,,"вул. Соборна, 42",Фастів,0
756324694,,,,,1715525,Детские товары >> Игрушки >> Пазлы >> Пазлы Trefl,trefl,Пазли (8 +) Trefl Африканські слони 1000 ел. (10442),,305,1,https://comfy.ua/pazly-kartonnye-8-trefl-afrikanskie-slony-1000-jel-10442.html,,06.11.2025 1:32,,"вул. Соборна, 42",Фастів,0
756324701,6651549,RUSSELL HOBBS,Рисоварка RUSSELL HOBBS Small (27020-56),1399,1717011,Техника для кухни >> Мелкая техника >> Мультиварки >> Мультиварки Russell Hobbs,russell-hobbs,Мультиварка Russell Hobbs 27020-56 Small,,1399,1,https://comfy.ua/mul-tivarka-russell-hobbs-27020-56-small.html,,05.11.2025 19:48,,"вул. Соборна, 42",Фастів,0
756324706,6651550,RUSSELL HOBBS,Рисоварка RUSSELL HOBBS 27040-56 Large,2099,1717012,Техника для кухни >> Мелкая техника >> Мультиварки >> Мультиварки Russell Hobbs,russell-hobbs,Мультиварка Russell Hobbs 27040-56 Large,,2099,1,https://comfy.ua/mul-tivarka-russell-hobbs-27040-56-large.html,,05.11.2025 19:52,,"вул. Соборна, 42",Фастів,0
756324707,6658568,2E,Портативная акустика 2E SoundXBlock Red (2E-BSSXBWRD),1199,1709930,"Аудио, фото и видео >> Акустика >> Портативные колонки >> Портативные колонки 2E",2e,Портативна акустика 2E SoundXBlock Red (2E-BSSXBWRD),,1199,1,https://comfy.ua/portativnaja-akustika-2e-soundxblock-red-2e-bssxbwrd.html,,05.11.2025 18:28,,"вул. Соборна, 42",Фастів,0
756324711,6630923,ECG,Блендер ECG RM 430,1130,1716929,Техника для кухни >> Мелкая техника >> Блендеры >> Блендеры ECG,ecg,Блендер заглибний ECG RM 430,,979,1,https://comfy.ua/blender-pogruzhnoj-ecg-rm-430.html,,05.11.2025 20:09,,"вул. Соборна, 42",Фастів,0
756324719,6645285,ECG,Встраиваемая микроволновая печь ECG MTD 2390 VGSS,11765,1716910,Техника для кухни >> Крупная техника >> Микроволновые печи >> Микроволновые печи ECG,ecg,Мікрохвильова піч (НВЧ) вбудовувана ECG MTD 2390 VGSS,,11765,1,https://comfy.ua/mikrovolnovaja-pech-svch-vstraivaemaja-ecg-mtd-2390-vgss.html,,05.11.2025 20:42,,"вул. Соборна, 42",Фастів,0
756349326,6651535,REMINGTON,Плойка REMINGTON CI89H1 HYDRAluxe,1899,1716990,Красота и здоровье >> Уход за волосами >> Плойки и стайлеры >> Плойки и стайлеры Remington,remington,Вирівнювач волосся Remington CI89H1 HYDRAluxe,,2179,1,https://comfy.ua/vyprjamitel-volos-remington-ci89h1-hydraluxe.html,2499,05.11.2025 19:09,,"вул. Соборна, 42",Фастів,0
756349331,6630934,ECG,Гриль ECG S 2070 Panini,1925,1716935,Техника для кухни >> Мелкая техника >> Грили-барбекю >> Грили-барбекю ECG,ecg,Гриль-барбекю електричний ECG S 2070 Panini,,1925,1,https://comfy.ua/gril-barbekju-jelektricheskij-ecg-s-2070-panini.html,,05.11.2025 19:54,,"вул. Соборна, 42",Фастів,0
756349333,6630945,ECG,Миксер ECG RS 5011,1845,1716931,Техника для кухни >> Мелкая техника >> Миксеры >> Миксеры ECG,ecg,Міксер ECG RS 5011,,1845,1,https://comfy.ua/mikser-ecg-rs-5011.html,,05.11.2025 20:03,,"вул. Соборна, 42",Фастів,0
