809911173,column,column,column,column,1770093,________________frosch,frosch,____frosch___750_,column,104,1,httpscomfyuasredstvodljachistkiunitazafroschgelmalina750mlhtml,176,05112025_1912,column,__42,Фастів,0
809911173,,,,,1770093,Бытовая химия >> Все для уборки >> Средства для чистки унитаза >> Средства для чистки унитаза Frosch,frosch,Засіб для чищення унітазу Frosch Гель Малина 750 мл,,104,1,https://comfy.ua/sredstvo-dlja-chistki-unitaza-frosch-gel-malina-750-ml.html,176,05.11.2025 19:12,,"вул. Соборна, 42",Фастів,0
809911839,,,,,1769996,Бытовая химия >> Средства для чистки техники >> Средства для чистки стиральных машин >> Средства для чистки стиральных машин Dr. Beckmann,dr-beckmann,Засіб від накипу для пральних машин Dr.BECKMANN Очищувач 250 мл,,140,1,https://comfy.ua/sredstvo-ot-nakipi-dlja-stiral-nyh-mashin-dr-beckmann-ochistitel-250-ml.html,205,05.11.2025 19:11,,"вул. Соборна, 42",Фастів,0
809911841,7066697,DR. BECKMANN,Чистящее средство Dr.Beckmann для стиральных машин 250 г (55703),204,1770033,Бытовая химия >> Средства для чистки техники >> Средства для чистки стиральных машин >> Средства для чистки стиральных машин Dr. Beckmann,dr-beckmann,Засіб від накипу для пральних машин Dr.BECKMANN Гігієнічний очищувач 250 г,,152,1,https://comfy.ua/sredstvo-ot-nakipi-dlja-stiral-nyh-mashin-dr-beckmann-gigienicheskij-ochistitel-250-g.html,227,05.11.2025 19:12,,"вул. Соборна, 42",Фастів,0
809911842,,,,,1770076,Бытовая химия >> Все для уборки >> Средства для чистки ванной >> Средства для чистки ванной Frosch,frosch,Засіб для миття у ванній кімнаті Frosch Очищувач лимон д/ванни і душа 500 мл,,129,1,https://comfy.ua/sredstvo-dlja-myt-ja-v-vannoj-komnate-frosch-ochistitel-limon-d-vanny-i-dusha-500-ml.html,209,05.11.2025 19:16,,"вул. Соборна, 42",Фастів,0
809911843,,,,,1770088,Бытовая химия >> Для кухни и мытья посуды,frosch,Засіб для ручного миття посуду Frosch Бальзам ZERO Аурум 500 мл,,146,1,https://comfy.ua/sredstvo-dlja-ruchnogo-myt-ja-posudy-frosch-bal-zam-zero-sensitiv-500-ml.html,209,05.11.2025 19:24,,"вул. Соборна, 42",Фастів,0
809911846,,,,,1770124,Бытовая химия >> Все для уборки,frosch,Засіб для чищення універсальний Frosch з натуральним екстрактом Грейпфрут 500 мл,,144,1,https://comfy.ua/chistjaschee-sredstvo-universal-noe-frosch-s-natural-nym-jekstraktom-grejpfrut-500-ml.html,242,05.11.2025 19:18,,"вул. Соборна, 42",Фастів,0
809911852,6583498,DR-BECKMANN,Гигиенический очиститель DR-BECKMANN для холодильников 250 г (4008455024516),283,1770048,Бытовая химия >> Средства для чистки техники >> Средства для чистки холодильников >> Средства для чистки холодильников Dr. Beckmann,dr-beckmann,Засіб для чищення холодильника Dr.BECKMANN Гігієнічний очисник д/холодильників 250 мл,,262,1,https://comfy.ua/chistjaschee-sredstvo-dlja-holodil-nika-dr-beckmann-gigienicheskij-ochistitel-d-holodil-nikov-250-ml.html,331,05.11.2025 19:13,,"вул. Соборна, 42",Фастів,0
809911917,,,,,1769989,Бытовая химия >> Все для уборки,dr-beckmann,Засіб по догляду за підлоговими покриттями Dr.BECKMANN Очиститель со щеткой 650 мл,,209,1,https://comfy.ua/mojuschee-sr-vo-dlja-kovrovogo-pokrytija-dr-beckmann-ochistitel-so-schetkoj-650-ml.html,442,05.11.2025 19:13,,"вул. Соборна, 42",Фастів,0
809911919,,,,,1770080,Бытовая химия >> Для кухни и мытья посуды >> Средства для мытья посуды >> Средства для мытья посуды Frosch,frosch,Засіб для ручного миття посуду Frosch Зелений Лимон 5 л,,439,1,https://comfy.ua/sredstvo-dlja-ruchnogo-myt-ja-posudy-frosch-zelenyj-limon-5-l.html,763,05.11.2025 19:20,,"вул. Соборна, 42",Фастів,0
809917803,7072590,JOSEPH JOSEPH,Терка JOSEPH JOSEPH Handi-Zest (20049),1599,1070162,"Посуда >> Нарезка и измельчение >> Терки, шинковки >> Терки, шинковки Joseph Joseph",joseph-joseph,Терка Joseph Joseph 20049,,1355,1,https://comfy.ua/terka-joseph-joseph-20049.html,,05.11.2025 19:54,,"вул. Соборна, 42",Фастів,0
809922473,,,,,.1777029,Инструменты и автотовары >> Ручные инструменты,stal,Ножівка Сталь 300 мм,,155,1,https://comfy.ua/nozhovka-stal-300-mm.html,,05.11.2025 21:49,,"вул. Соборна, 42",Фастів,0
809922474,6660809,СТАЛЬ,Пила садовая СТАЛЬ 180 мм (40117),147,1777030,"Инструменты и автотовары >> Ручные инструменты >> Ножовки, пилы и полотна >> Ножовки, пилы и полотна Сталь",stal,Ножівка Сталь 180 мм (40117),,235,1,https://comfy.ua/nozhovka-stal-180-mm-40117.html,,05.11.2025 20:48,,"вул. Соборна, 42",Фастів,0
809922476,,,,,1777026,"Инструменты и автотовары >> Ручные инструменты >> Ножовки, пилы и полотна >> Ножовки, пилы и полотна Сталь",stal,Ножівка Сталь 400 мм (40118),,349,1,https://comfy.ua/nozhovka-stal-400-mm-40118.html,,05.11.2025 22:25,,"вул. Соборна, 42",Фастів,0
809922477,,,,,1777027,"Инструменты и автотовары >> Ручные инструменты >> Ножовки, пилы и полотна >> Ножовки, пилы и полотна Сталь",stal,Ножівка Сталь 450 мм (40119),,389,1,https://comfy.ua/nozhovka-stal-450-mm-40119.html,,05.11.2025 23:07,,"вул. Соборна, 42",Фастів,0
809922479,,,,,.1777034,Инструменты и автотовары >> Ручные инструменты,stal,Ножівка Сталь 350 мм,,369,1,https://comfy.ua/nozhovka-stal-350-mm.html,,05.11.2025 21:53,,"вул. Соборна, 42",Фастів,0
809922481,,,,,.1776033,Инструменты и автотовары >> Ручные инструменты,haisser,Ножівка Haisser по дереву 11TPI 3D 350 мм,,459,1,https://comfy.ua/nozhovka-haisser-po-derevu-11tpi-3d-350-mm.html,,05.11.2025 23:08,,"вул. Соборна, 42",Фастів,0
809922482,,,,,.1776030,Инструменты и автотовары >> Ручные инструменты,haisser,Ножівка Haisser по дереву  7TPI 3D 450 мм,,509,1,https://comfy.ua/nozhovka-haisser-po-derevu-7tpi-3d-450-mm.html,,05.11.2025 21:53,,"вул. Соборна, 42",Фастів,0
809922485,6687083,NEO TOOLS,Ножовка NEO TOOLS 300 мм (43-302),555,1767616,"Инструменты и автотовары >> Ручные инструменты >> Ножовки, пилы и полотна >> Ножовки, пилы и полотна Neo Tools",neo-tools,"Ножівка Neo Tools 300 мм, двухкомпонентная ручка (43-302)",,555,1,https://comfy.ua/nozhovka-neo-tools-300-mm-dvuhkomponentnaja-ruchka-43-302.html,,05.11.2025 23:10,,"вул. Соборна, 42",Фастів,0
809923203,,,,,.1776590,Инструменты и автотовары >> Расходные материалы,stal,Стрижень для клейового пістолета Сталь 7.2х200 мм 12 шт. (80220),,62,1,https://comfy.ua/sterzhen-dlja-kleevogo-pistoleta-stal-7-2h200-mm-12-sht-80220.html,,05.11.2025 20:51,,"вул. Соборна, 42",Фастів,0
809923204,,,,,1776366,Инструменты и автотовары >> Расходные материалы,stal,Стрижень для клейового пістолета Сталь 11.2х200 мм 12 шт. (80210),,135,1,https://comfy.ua/sterzhen-dlja-kleevogo-pistoleta-stal-11-2h200-mm-12-sht-80210.html,,05.11.2025 20:51,,"вул. Соборна, 42",Фастів,0
809923205,,,,,.1776365,Инструменты и автотовары >> Расходные материалы,stal,Стрижень для клейового пістолета Сталь 11.2х200 мм 12 шт. (80200),,125,1,https://comfy.ua/sterzhen-dlja-kleevogo-pistoleta-stal-11-2h200-mm-12-sht-80200.html,,05.11.2025 21:49,,"вул. Соборна, 42",Фастів,0
809923206,,,,,.1776364,Инструменты и автотовары >> Расходные материалы,stal,Стрижень для клейового пістолета Сталь 11.2х200 мм 12 шт. (80190),,125,1,https://comfy.ua/sterzhen-dlja-kleevogo-pistoleta-stal-11-2h200-mm-12-sht-80190.html,,05.11.2025 21:51,,"вул. Соборна, 42",Фастів,0
809923207,,,,,.1776367,Инструменты и автотовары >> Расходные материалы,stal,Стрижень для клейового пістолета Сталь 11.2х300 мм (80170),,529,1,https://comfy.ua/sterzhen-dlja-kleevogo-pistoleta-stal-11-2h300-mm-80170.html,,05.11.2025 21:57,,"вул. Соборна, 42",Фастів,0
809923208,,,,,.1776368,Инструменты и автотовары >> Расходные материалы,stal,Стрижень для клейового пістолета Сталь 11.2х300 мм (80180),,415,1,https://comfy.ua/sterzhen-dlja-kleevogo-pistoleta-stal-11-2h300-mm-80180.html,,05.11.2025 22:04,,"вул. Соборна, 42",Фастів,0
809924554,,,,,.1776540,Инструменты и автотовары >> Ручные инструменты,stal,Мультитул Сталь 12 в 1 165 мм (41160),,639,1,https://comfy.ua/mul-titul-stal-12-v-1-165-mm-41160.html,,05.11.2025 21:40,,"вул. Соборна, 42",Фастів,0
809924710,6662579,СТАЛЬ,Отвертка двусторонняя СТАЛЬ (49091) PH2 х SL6 75 мм (102720),62,1774891,Инструменты и автотовары >> Ручные инструменты >> Отвертки >> Отвертки Сталь,stal,Викрутка Сталь PH2хSL6 75 мм (49091),,79,1,https://comfy.ua/otvertka-stal-ph2hsl6-75-mm-49091.html,,05.11.2025 21:58,,"вул. Соборна, 42",Фастів,0
809924711,6626073,HAISSER,Отвертка HAISSER 49128 S2 SL5x100 мм (94806),113,1775015,Инструменты и автотовары >> Ручные инструменты >> Отвертки >> Отвертки Haisser,haisser,Викрутка Haisser S2 SL5x100 мм (49128),,115,1,https://comfy.ua/otvertka-haisser-s2-sl5x100-mm-49128.html,,05.11.2025 22:26,,"вул. Соборна, 42",Фастів,0
809924712,6626068,HAISSER,Отвертка HAISSER 49122 S2 PH1x100 мм (94794),82,1775018,Инструменты и автотовары >> Ручные инструменты >> Отвертки >> Отвертки Haisser,haisser,Викрутка Haisser S2 PH1x100 мм (49122),,115,1,https://comfy.ua/otvertka-haisser-s2-ph1x100-mm-49122.html,,05.11.2025 21:58,,"вул. Соборна, 42",Фастів,0
809924713,6626070,HAISSER,Отвертка HAISSER 49124 S2 PH2x100 мм (94798),96,1775017,Инструменты и автотовары >> Ручные инструменты >> Отвертки >> Отвертки Haisser,haisser,Викрутка Haisser S2 PH2x100 мм (49124),,125,1,https://comfy.ua/otvertka-haisser-s2-ph2x100-mm-49124.html,,05.11.2025 21:58,,"вул. Соборна, 42",Фастів,0
809924714,6626071,HAISSER,Отвертка HAISSER 49125 S2 PH2x150 мм (94800),107,1775016,Инструменты и автотовары >> Ручные инструменты >> Отвертки >> Отвертки Haisser,haisser,Викрутка Haisser S2 PH2x150 мм (49125),,135,1,https://comfy.ua/otvertka-haisser-s2-ph2x150-mm-49125.html,,05.11.2025 23:08,,"вул. Соборна, 42",Фастів,0
809924715,6662580,СТАЛЬ,Отвертка держатель бит СТАЛЬ 49094 160 мм (102723),54,1774899,Инструменты и автотовары >> Ручные инструменты >> Отвертки >> Отвертки Сталь,stal,Тримач для біт Сталь 160 мм (49094),,80,1,https://comfy.ua/derzhatel-dlja-bit-stal-160-mm-49094.html,,05.11.2025 21:41,,"вул. Соборна, 42",Фастів,0
809925079,6662570,СТАЛЬ,Отвертка СТАЛЬ с трещеткой 12 в 1 (49093),215,1774903,Инструменты и автотовары >> Ручные инструменты >> Отвертки >> Отвертки Сталь,stal,Викрутка зі змінними бітами Сталь 12 в 1 (49093),,215,1,https://comfy.ua/otvertka-so-smennymi-bitami-stal-12-v-1-49093.html,,05.11.2025 21:53,,"вул. Соборна, 42",Фастів,0
809925080,,,,,1776066,Инструменты и автотовары >> Ручные инструменты >> Отвертки >> Отвертки Сталь,stal,"Набір викруток Сталь 6 шт. (SL5x75, SL6x100, SL8x150mm, PH1x75, PH2x100, PH3x150mm) (49096)",,385,1,https://comfy.ua/nabor-otvertok-stal-6-sht-sl5x75-sl6x100-sl8x150mm-ph1x75-ph2x100-ph3x150mm-49096.html,,05.11.2025 21:50,,"вул. Соборна, 42",Фастів,0
809925081,,,,,1774902,Инструменты и автотовары >> Ручные инструменты,stal,Викрутка зі змінними бітами Сталь 26 в 1 (49095),,375,1,https://comfy.ua/otvertka-so-smennymi-bitami-stal-26-v-1-49095.html,,05.11.2025 21:42,,"вул. Соборна, 42",Фастів,0
809925082,6662569,СТАЛЬ,Отвертка СТАЛЬ ударно-поворотная 8 в 1 (49090),341,1774900,Инструменты и автотовары >> Ручные инструменты >> Отвертки >> Отвертки Сталь,stal,Викрутка зі змінними бітами Сталь 8 в 1 (49090),,465,1,https://comfy.ua/otvertka-so-smennymi-bitami-stal-8-v-1-49090.html,,05.11.2025 21:44,,"вул. Соборна, 42",Фастів,0
809925788,6573212,EINHELL,Шуруповерт EINHELL X-Change TE-CD 18/40 Li-Solo (4513925),1992,1774403,Инструменты и автотовары >> Электроинструменты >> Шуруповерты >> Шуруповерты Einhell,einhell,Дриль-шуруповерт Einhell TE-CD 18/40 Li-Solo (4513925),,1995,1,https://comfy.ua/drel-shurupovert-einhell-te-cd-18-40-li-solo-4513925.html,,05.11.2025 21:40,,"вул. Соборна, 42",Фастів,0
809925853,6705505,BOSCH,Гайковерт BOSCH ударный GDS 18V-1050 H (0.601.9J8.500),12840,1769618,Инструменты и автотовары >> Электроинструменты >> Шуруповерты >> Шуруповерты Bosch,bosch,Гайковерт акумуляторний Bosch GDS 18V-1050 H 18В (0.601.9J8.500),,12839,1,https://comfy.ua/gajkovert-akkumuljatornyj-bosch-gds-18v-1050-h-18v-0-601-9j8-500.html,,05.11.2025 21:41,,"вул. Соборна, 42",Фастів,0
809926677,6604883,GRUNHELM,Кофемолка GRUNHELM GC3250S (101852),799,1776820,Техника для кухни >> Мир кофе >> Кофемолки >> Кофемолки Grunhelm,grunhelm,Кавомолка Grunhelm GС3250S,,799,1,https://comfy.ua/kofemolka-grunhelm-gs3250s.html,,05.11.2025 17:32,,"вул. Соборна, 42",Фастів,0
809927908,,,,,1749291,Техника для дома >> Аксессуары к крупной технике >> Комплекты креплений для установки >> Комплекты креплений для установки Samsung,samsung,Комплект кріплень для установки в колону Samsung SKK-UDW,,2499,1,https://comfy.ua/komplekt-kreplenij-dlja-ustanovki-v-kolonnu-samsung-skk-udw.html,2699,05.11.2025 17:40,,"вул. Соборна, 42",Фастів,0
809929227,6679822,ARDESTO,Сушилка для продуктов ARDESTO FDB-1138,3899,1777815,Техника для кухни >> Хранение продуктов >> Сушилки для овощей и фруктов >> Сушилки для овощей и фруктов Ardesto,ardesto,Сушарка для фруктів та овочів Ardesto FDB-1138,,3899,1,https://comfy.ua/sushilka-dlja-fruktov-i-ovoschej-ardesto-fdb-1138.html,,05.11.2025 17:27,,"вул. Соборна, 42",Фастів,0
809930704,6686918,EINHELL,Триммер Einhell X-Change GC-CT 18/24 Li - Solo (3411123),2189,1774399,"Инструменты и автотовары >> Садовые инструменты >> Триммеры, мотокосы, электрокосы >> Триммеры, мотокосы, электрокосы Einhell",einhell,Тример садовий Einhell GC-CT 18/24 Li - Solo (3411123),,2189,1,https://comfy.ua/trimmer-sadovyj-einhell-gc-ct-18-24-li-solo-3411123.html,,05.11.2025 21:11,,"вул. Соборна, 42",Фастів,0
809930707,6664101,GRUNHELM,Мотокоса GRUNHELM GR-5200М (104906),3896,1775104,"Инструменты и автотовары >> Садовые инструменты >> Триммеры, мотокосы, электрокосы >> Триммеры, мотокосы, электрокосы Grunhelm",grunhelm,Мотокоса бензинова Grunhelm GR-5200МS,,4505,1,https://comfy.ua/motokosa-benzinovaja-grunhelm-gr-5200m.html,,05.11.2025 21:09,,"вул. Соборна, 42",Фастів,0
809931167,,,,,1770031,Бытовая химия >> Средства для стирки,dr-beckmann,Засіб для видалення плям Dr.BECKMANN Роллер 75 мл,,99,1,https://comfy.ua/sredstvo-dlja-udalenija-pjaten-dr-beckmann-roller-75-ml.html,160,05.11.2025 19:17,,"вул. Соборна, 42",Фастів,0
809931175,,,,,1770063,Бытовая химия >> Средства для стирки,frosch,Ополіскувач для білизни Frosch Квіти бавовника 750 мл,,109,1,https://comfy.ua/opolaskivatel-dlja-bel-ja-frosch-cvety-h-lopchatnika-750-ml.html,180,05.11.2025 19:19,,"вул. Соборна, 42",Фастів,0
809931178,,,,,1770096,Бытовая химия >> Средства для стирки >> Ополаскиватели для белья >> Ополаскиватели для белья Frosch,frosch,Ополіскувач для білизни Frosch Лаванда 750 мл,,110,1,https://comfy.ua/opolaskivatel-dlja-bel-ja-frosch-lavanda-750-ml.html,180,05.11.2025 19:15,,"вул. Соборна, 42",Фастів,0
809931296,,,,,1770065,Бытовая химия >> Средства для стирки >> Ополаскиватели для белья >> Ополаскиватели для белья Frosch,frosch,Ополіскувач для білизни Frosch Мигдальне молочко 1 л,,119,1,https://comfy.ua/opolaskivatel-dlja-bel-ja-frosch-mindal-noe-molochko-1-l.html,201,05.11.2025 19:11,,"вул. Соборна, 42",Фастів,0
809931299,,,,,1770097,Бытовая химия >> Средства для стирки >> Ополаскиватели для белья >> Ополаскиватели для белья Frosch,frosch,Ополіскувач для білизни Frosch ZERO Аурум 750 мл,,129,1,https://comfy.ua/opolaskivatel-dlja-bel-ja-frosch-zero-sensitiv-750-ml.html,197,05.11.2025 19:18,,"вул. Соборна, 42",Фастів,0
809936482,,,,,1770057,Бытовая химия >> Средства для стирки >> Гели для стирки >> Гели для стирки Frosch,frosch,"Гель для прання Frosch Концентрат Алое Вера 1,5 л",,332,1,https://comfy.ua/gel-dlja-stirki-frosch-koncentrat-aloje-vera-1-5-l.html,652,05.11.2025 19:09,,"вул. Соборна, 42",Фастів,0
809936483,,,,,1770058,Бытовая химия >> Средства для стирки,frosch,"Гель для прання Frosch Бальзам д/вовни Минда льное молочко 1,5 л",,347,1,https://comfy.ua/gel-dlja-stirki-frosch-bal-zam-d-shersti-minda-l-noe-molochko-1-5-l.html,,05.11.2025 19:12,,"вул. Соборна, 42",Фастів,0
809936485,,,,,1770069,Бытовая химия >> Средства для стирки >> Гели для стирки >> Гели для стирки Frosch,frosch,"Гель для прання Frosch Концентрат Сода 1,5 л",,369,1,https://comfy.ua/gel-dlja-stirki-frosch-koncentrat-soda-1-5-l.html,652,05.11.2025 19:13,,"вул. Соборна, 42",Фастів,0
809936493,,,,,1770023,Бытовая химия >> Средства для стирки >> Гели для стирки >> Гели для стирки Frosch,frosch,"Гель для прання Frosch ZERO Аурум 1,5 л",,449,1,https://comfy.ua/gel-dlja-stirki-frosch-zero-sensitiv-1-5-l.html,774,05.11.2025 19:11,,"вул. Соборна, 42",Фастів,0
809947167,,,,,1770088,Бытовая химия >> Для кухни и мытья посуды,frosch,Засіб для ручного миття посуду Frosch Бальзам ZERO Аурум 500 мл,,146,1,https://comfy.ua/catalog/product/view/id/2146023,209,05.11.2025 19:24,,"вул. Соборна, 42",Фастів,0
809987284,,,,,1777665,Техника для кухни >> Мелкая техника >> Миксеры >> Миксеры Ariete,ariete,Міксер з чашею Ariete 1588 Beige,,6999,1,https://comfy.ua/mikser-s-chashej-ariete-1588-beige.html,,05.11.2025 19:53,,"вул. Соборна, 42",Фастів,0
809991588,,,,,1770118,Бытовая химия >> Все для уборки >> Универсальные средства для уборки >> Универсальные средства для уборки Frosch,frosch,Засіб для чищення універсальний Frosch Очищає молочко Апельсин 500 мл,,73,1,https://comfy.ua/chistjaschee-sredstvo-universal-noe-frosch-ochischajuschee-molochko-apel-sin-500-ml.html,138,05.11.2025 19:21,,"вул. Соборна, 42",Фастів,0
809991589,,,,,1770140,Бытовая химия >> Все для уборки >> Универсальные средства для уборки >> Универсальные средства для уборки Frosch,frosch,Засіб для чищення універсальний Frosch Апельсин 750 мл,,99,1,https://comfy.ua/chistjaschee-sredstvo-universal-noe-frosch-apel-sin-750-ml.html,143,05.11.2025 19:22,,"вул. Соборна, 42",Фастів,0
809991590,,,,,1770211,Бытовая химия >> Все для уборки >> Универсальные средства для уборки >> Универсальные средства для уборки Frosch,frosch,Засіб для чищення універсальний Frosch Лаванда 750мл,,99,1,https://comfy.ua/chistjaschee-sredstvo-universal-noe-frosch-lavanda-750ml.html,143,05.11.2025 19:20,,"вул. Соборна, 42",Фастів,0
